Date,Title
2016/9/16,US STOCKS-Wall St lifted by banks as Fed meeting nears
2016/9/19,"US STOCKS SNAPSHOT-Wall St ends flat as banks gain, Apple weighs"
2016/9/19,Elton John kicks off Apple Music Festival in London
2016/9/19,"US STOCKS-Wall St ends flat as banks gain, Apple drags"
2016/9/19,Cox: Apple and Tesla really need each other now
2016/9/20,Israel chip designer Ceva rallies as iPhone win to boost profit
2016/9/20,Clash of Clans' maker Supercell buys majority stake in next door start-up
2016/9/21,BlackBerry to resell app from startup that found major Android bug
2016/9/21,Supercar maker McLaren says not in discussion with Apple
2016/9/21,Latest Apple rumor may vanish as fast as a McLaren
2016/9/22,US STOCKS-Nasdaq hits record high after Fed leaves rates unchanged
2016/9/22,US STOCKS-Wall St falls as energy lags; stocks end week up
2016/9/23,"Exclusive: Japan's antitrust watchdog considers action against Apple, carriers - sources"
2016/9/23,Wall Street falls as energy lags; shares post gains on week
2016/9/23,OECD official says EU Apple ruling not precedent for future tax cases
2016/9/26,"Nikkei falls on strong yen, selling in Apple suppliers"
2016/9/26,LVMH's digital drive takes time despite Apple hire
2016/9/26,"US STOCKS SNAPSHOT-Wall St opens lower, weighed down by Apple"
2016/9/27,Apple deepens enterprise push with Deloitte partnership
2016/9/28,"US STOCKS SNAPSHOT-Wall St falls as banks, Apple drag"
2016/9/29,Wall Street falls sharply on worries about banks
2016/9/29,"US STOCKS-Wall St dragged down by Apple, health stocks"
2016/9/29,"Apple loses patent retrial to VirnetX, owes $302.4 million"
2016/9/30,"US STOCKS-Wall St boosted by financial, tech stocks"
2016/9/30,Broadcom's stock could increase by more than 20 pct -Barron's
2016/10/2,French insurer AXA's CEO has no plans for big mergers: report
2016/10/3,Foxconn's FIH Mobile warns of 52 pct drop in net profit in 2016
2016/10/3,Apple launches Apple Pay payment service in Russia
2016/10/4,PepsiCo misleads buyers of Naked juice: lawsuit
2016/10/4,US STOCKS-Wall St see-saws as investors assess rate-hike chances
2016/10/4,PepsiCo misleads buyers of Naked juice -lawsuit
2016/10/4,Google phones target Apple but could leave Samsung vulnerable
2016/10/4,"Google will not make a Twitter bid and Apple also an unlikely suitor - Recode, citing sources"
2016/10/5,"Google takes on Apple, Amazon with new hardware push"
2016/10/5,Twitter drops 9 percent after report that Google won't bid
2016/10/5,Dialog Semi reviews guidance as Chinese holiday boosts third quarter sales
2016/10/6,Twitter shares plunge on report Google has no plan to make bid
2016/10/6,FBI says Minnesota mall attack was premeditated
2016/10/6,U.S. court reinstates Apple $120 million patent win over Samsung
2016/10/7,Google starts big advertising push around new Pixel phone
2016/10/7,Nortel units seek more time for talks to split $7.3 billion
2016/10/7,Netflix CEO says China entry doesn't look good
2016/10/7,Google starts big advertising push around new Pixel phone
2016/10/7,Twitter's shares slump on report that bids are unlikely
2016/10/10,"US STOCKS SNAPSHOT-Wall St rises on energy, Apple boost"
2016/10/10,US STOCKS-Wall St drops as earnings season begins on dour note
2016/10/11,Apple-Samsung iPhone patent feud leaves U.S. top court struggling
2016/10/11,US STOCKS-Wall St falls as Alcoa's results disappoint
2016/10/11,"Apple to set up R&D centre in Shenzhen, bolster China ties"
2016/10/12,Huawei and Lenovo salivate at Samsung phone fail
2016/10/12,Amazon challenges Apple and Spotify with new music streaming service
2016/10/12,"Taiwan stocks slip ahead of earnings, views by key tech shares"
2016/10/13,INSIGHT-Plunging pound and threats put EU farm workers off the UK
2016/10/13,"Apple to set up R&D center in Shenzhen, bolster China ties"
2016/10/14,Popular wrist-worn fitness trackers vary in heart rate readings
2016/10/18,"Sharp says expects significant profit improvement, shares surge"
2016/10/19,Apple supplier Laird warns of sharply lower profit; shares plunge
2016/10/19,"CORRECTED- 1-Smartphone component supplier Laird warns of lower FY profit, shares plunge"
2016/10/20,Plunging pound and threats put EU farm workers off the UK
2016/10/20,EU court adviser backs Intel fight against record EU fine
2016/10/20,Verizon revenue drops as subscriber additions disappoint
2016/10/21,Apple says some users on multiple iCloud services affected on Friday
2016/10/21,Apple approached Time Warner a few months ago about possible merger - WSJ
2016/10/21,"Nintendo unveils new console, shares slide as features underwhelm"
2016/10/24,Time Warner CEO says only AT&T approached with offer
2016/10/24,"Apple says 'Apple Watch Nike+' will be available Friday, Oct. 28"
2016/10/24,Pandora Media cuts revenue forecast amid stiff competition
2016/10/25,Apple iPhone sales beat estimates
2016/10/25,US STOCKS-Wall St falls as earnings from some big names disappoint
2016/10/25,BlackBerry launches last phone it will carry on its books
2016/10/25,Pandora Media reports third straight quarterly loss
2016/10/25,"For Apple, surprise hunger for big phones leaves money on table"
2016/10/25,US STOCKS-Wall St opens flat as investors assess earnings
2016/10/25,BlackBerry launches its third Android-based phone
2016/10/25,"Target to offer more deals, extend free shipping until January"
2016/10/25,"Samsung chip supplier AMS warns of customer setback, shares plunge"
2016/10/25,LG Display says its Q4 panel shipments to a key client to rise
2016/10/25,US STOCKS-Wall St set to open flat as investors assess earnings
2016/10/25,US STOCKS SNAPSHOT-Wall St opens flat as investors assess earnings
2016/10/25,US STOCKS-Wall St slips on earnings; Apple falls late after results
2016/10/25,Wall Street slips on earnings; Apple falls late after results
2016/10/25,"US STOCKS SNAPSHOT-Nasdaq, S&P fall but Dow rises on earnings flurry"
2016/10/26,Apple slips as supply woes weigh on holiday sales forecast
2016/10/26,"US STOCKS-Boeing rally lifts Dow, Apple weighs on S&P, Nasdaq"
2016/10/26,"GLOBAL MARKETS-Apple weighs on Wall St; oil, gold prices slip"
2016/10/26,"In China, some Apple users opt for iPhone makeover rather than buy new"
2016/10/26,"Apple weighs on Wall Street; oil, gold prices slip"
2016/10/26,Earnings in focus as Apple weighs; Boeing lifts Dow
2016/10/26,GLOBAL MARKETS-Apple results weigh on Wall St; oil cuts some losses
2016/10/26,"US STOCKS-Wall St lower, Apple set for worst day in 6 months"
2016/10/26,Reuters TV comes to Roku
2016/10/27,Italy judge agrees tax probe settlement with head of Apple's Irish unit: source
2016/10/27,SE Asia Stocks-Mostly down; Philippines extends losses to sixth day
2016/10/27,US STOCKS-Futures rise as earnings continue to be prime focus
2016/10/27,"Apple adds touch screen keys to MacBook Pro, price jump startles some"
2016/10/27,Apple says AirPod shipments to be delayed
2016/10/27,STMicro expects improved profitability in 2016
2016/10/27,Tech privacy ally Feingold leads in Wisconsin U.S. Senate race
2016/10/27,"GLOBAL MARKETS-Asia shares extend losses, dollar firms but off highs"
2016/10/27,Apple says new Macbook Pros available starting at $1499- event
2016/10/27,Google tries new approach with voice on Pixel phone
2016/10/28,Norway's wealth fund removes Brexit uncertainty from UK property portfolio valuation
2016/10/28,Cirrus Logic surges as Wall Street plugs in high-tech earbuds
2016/10/28,Amazon targets Chinese demand for overseas shopping with Prime launch
2016/10/31,Samsung Electronics CEO says firm must learn from crisis
2016/11/1,"Women executives left Yahoo in U.S. amid layoffs, deal talk"
2016/11/1,Airbnb tells China users personal data to be stored locally
2016/11/1,Scales corporation unit entered into agreement to acquire 100% of shares in Longview Group
2016/11/2,Fitbit needs new hit for shares to regain health
2016/11/3,Huawei launches new premium phone that can learn
2016/11/3,Huawei wants to beat Apple in smartphones in two years: exec
2016/11/3,Samsung America says it has replaced most recalled Galaxy Note 7s
2016/11/4,Hong Kong can stand up to Jack Ma
2016/11/4,US STOCKS-Futures rally as FBI clears Clinton
2016/11/7,U.S. states join Dow-DuPont merger probe -sources
2016/11/7,"Trump election ignites fears over U.S. encryption, surveillance policy"
2016/11/9,World Bank probe into Tata tea project finds it failed to protect Indian workers
2016/11/9,Ireland says Trump plans should not hurt it as multinational hub
2016/11/9,"Apple CFO Maestri sells 16,950 shares of co's common stock on Nov 7"
2016/11/9,"US STOCKS-Wall Street gains, bank sector surges to 2008 high"
2016/11/10,Rubik's Cube loses EU trademark fight over its shape
2016/11/10,"Loeb's Third Point takes share stake in Apple, Visa and Dell"
2016/11/10,"Google's Android expands competition, does not hurt it - Google lawyer"
2016/11/10,Google lawyer says Android helps rather than harms competition
2016/11/10,"Trump bets blast Dow to new high, bank sector hits 2008 levels"
2016/11/10,"US STOCKS-Trump bets blast Dow to new high, bank sector hits 2008 levels"
2016/11/10,Taiwan's Hon Hai falls in early trade
2016/11/10,US STOCKS-Wall St set to open higher as investors cheer Trump win
2016/11/10,"US STOCKS SNAPSHOT-Wall St ends higher, helped by banks, industrials"
2016/11/10,US STOCKS-Wall St set to open lower as investors adjust portfolios
2016/11/11,US STOCKS-Futures fall as investors adjust portfolios after Trump win
2016/11/11,Taiwan's Hon Hai logs 4th quarterly net profit fall after Sharp acquisition
2016/11/11,US STOCKS-Trump rally falters as investors seek more clarity
2016/11/14,US STOCKS-Wall St ends flat as financials' rise offsets tech drop
2016/11/14,EU Commission puts fintech review on agenda for 2017
2016/11/14,"U.S. internet firms ask Trump to support encryption, ease regulations"
2016/11/14,Apple stock extends losses after China warning about Trump
2016/11/14,RPT-Apple stock extends losses after China warning about Trump
2016/11/14,"In phone call, China's Xi tells Trump cooperation is only choice"
2016/11/15,Facebook's WhatsApp adds secure video calling amid privacy concerns
2016/11/15,"GLOBAL MARKETS-Oil rallies on output bets; U.S. yields, dollar steady"
2016/11/15,Chinese consumers' body takes up complaints of iPhone shutdowns with Apple
2016/11/15,Target expresses confidence about holiday sales; shares rise
2016/11/16,"Apple, tech stocks show signs of life after Trump thump"
2016/11/16,Huawei hopes cheaper Nova will maintain smartphone growth in Africa
2016/11/17,US STOCKS-S&P higher as Yellen remarks boost bank stocks
2016/11/17,Uber says Taiwan's steps against it hurting citizens
2016/11/17,"Google, an Obama ally, may face policy setbacks under Trump"
2016/11/17,"Uber says Taiwan's steps against it hurt citizens, deter foreign investment"
2016/11/17,"Under pressure on U.S. jobs, Ford tries new gambit with Trump"
2016/11/18,"McLaren shareholders have rejected bids, not looking to sell"
2016/11/20,Drake looks for first American Music Awards but out of top prize
2016/11/20,Galaxy Note 7 recall did not damage Samsung brand in U.S.: Reuters/Ipsos poll
2016/11/21,"EU has no concerns yet about UK's Nissan deal, awaits details"
2016/11/21,"Apple abandons development of wireless routers - Bloomberg, citing sources"
2016/11/21,India's Ola adds entertainment features as ride-hailing competition rages
2016/11/22,Kcell board approves agreement with Apple Distribution International Ltd
2016/11/22,China will defend WTO rights if Trump moves on tariffs: official
2016/11/23,"US STOCKS-Industrials lift Dow to record, techs drag S&P and Nasdaq"
2016/11/23,U.S. offers mobile device guidelines to curb driver distraction
2016/11/23,"As Samsung moves on from Note 7 crisis, SDI battery affiliate struggles"
2016/11/23,Ukraine students use computer keyboard keys for Steve Jobs portrait
2016/11/24,"Wall Street finishes at record highs consumer staples, techs gain"
2016/11/25,"Washington crushes Washington State, reaches Pac-12 title game"
2016/11/25,Castro embodied the weakness of strongmen
2016/11/28,Former regulatory official seeks to take over TransAsia - Apple newspaper
2016/11/28,Apple iPhone with curved screen could come as soon as next year - WSJ
2016/11/28,AT&T unveils DirecTV Now streaming service ahead of November 30 launch
2016/11/28,Taiwan stocks rise to near 3-week high; techs up
2016/11/28,"Grammy Awards may return to New York, but not a done deal: source"
2016/11/29,Samsung sets cautious tone with activist fund
2016/11/30,Federal Circuit invalidates Ameranth online-menu patents
2016/11/30,Netflix allows subscribers to binge-watch shows offline
2016/11/30,Two tech companies win first Stop Slavery Award after workforce scrutiny
2016/11/30,"Carrier gets state incentives, Trump pledge for keeping U.S. jobs"
2016/11/30,"US STOCKS-Oil, bank stocks send S&P, Dow to record highs"
2016/11/30,"HP Enterprise, NXP win Thomson Reuters Foundation anti-slavery awards"
2016/12/1,Apple's Sewell tops list of highest-paid GCs at U.S. public companies
2016/12/1,Two tech companies win first Stop Slavery Award after workforce scrutiny
2016/12/1,"US STOCKS-Tech stocks weigh on S&P, Nasdaq"
2016/12/1,"Nikkei dips as investors take profits, on track for weekly gain"
2016/12/1,"US STOCKS-S&P, Nasdaq dragged down by losses in tech stocks"
2016/12/1,Taiwan stocks hit one-week low with overseas markets; techs drag
2016/12/1,"Fallen smartphone brand Nokia challenges Apple, Samsung again"
2016/12/2,Move to name Paris street after Steve Jobs has leftists up in arms
2016/12/2,Trump creates business advisory council stacked with CEOs
2016/12/3,"For Apple and others, tin supply chain has ties to rebel-held Myanmar mine"
2016/12/3,Apple shows ambition to get into self-driving car race
2016/12/3,"Apple Watch sales to consumers set record in holiday week, says Apple's Cook"
2016/12/5,VW's new division takes aim at Uber-style competition
2016/12/5,"Discounts, advertising spur brisk Apple Watch sales"
2016/12/6,Samsung Elec says U.S. court ruling in patent case a victory
2016/12/6,Cyber security start-up Secdo raises $10 million
2016/12/6,Apple says iPhone 6 battery fires in China likely caused by external factors
2016/12/6,"S.Korea stocks flat despite Samsung Electronics' record high, won edges up"
2016/12/6,U.S. Supreme Court backs Samsung in smartphone fight with Apple
2016/12/6,Cyber security start-up Secdo raises $10 mln
2016/12/6,London tech leaders propose post-Brexit plan to British government
2016/12/6,"Starbucks sets five-year growth targets, to open 12,000 more stores"
2016/12/7,Foxconn says in preliminary discussions to expand its U.S. operations
2016/12/7,Apple said in talks with film studios for early movie rental - Bloomberg
2016/12/7,AT&T touts Time Warner merger at U.S. Senate hearing
2016/12/7,Xinjiang Goldwind Science & Technology's unit plans cooperation with Apple
2016/12/8,"US STOCKS-Tech, bank stocks drive Wall Street to new high"
2016/12/8,US STOCKS-Indexes hit record highs as Trump rally continues
2016/12/9,Nikkei rises to fresh 1-year high on strong Wall St; defensive stocks catch up
2016/12/11,Taiwan stocks fall on profit-taking; tech heavyweights down
2016/12/11,"Apple and Softbank discussed an investment of up to $1 bln in Softbank Technology Fund - WSJ, citing sources"
2016/12/12,SoftBank and Apple are in talks about potential $1 bln investment in new Softbank technology fund - source
2016/12/12,"Apple has held talks to invest in $100 billion Softbank Technology Fund that Softbank CEO touted alongside Trump on Friday - CNBC,citing Dow Jones"
2016/12/12,"Factbox: Trump meetings include rapper Kanye West, Microsoft founder Bill Gates"
2016/12/13,HMD launches its first new Nokia phones
2016/12/13,"Tech employees vow not to help Trump surveil Muslims, deport immigrants"
2016/12/13,"US STOCKS-Wall St adds to record rally, Dow approaches 20000"
2016/12/13,Apple said airpods are available to order online now from apple.com
2016/12/13,"Abandoned CBS, Viacom merger leaves scale issue lingering"
2016/12/14,Google extends conservative outreach as Trump calls tech meeting
2016/12/14,Trump meets Silicon Valley elite after mutual mistrust in campaign
2016/12/14,"GLOBAL MARKETS-Asia resigned to Fed hike, uptight on rate outlook"
2016/12/14,US STOCKS-Futures little changed ahead of Fed decision
2016/12/14,Lower CEO pay equates to higher shareholder rewards: James Saft
2016/12/15,Washington state coroner's inquest finds police shooting justified
2016/12/15,Blackberry says China's TCL to make BlackBerry-branded devices
2016/12/15,Apple Inc board adopted amendments to apple's amended and restated bylaws
2016/12/15,Porsche race car engineer joins Apple: source
2016/12/16,"EU court ruling on Spanish tax breaks eyed for clues on Starbucks, Apple appeals"
2016/12/16,Apple can sell iPhone 7s in Indonesia after R&D investment commitment
2016/12/16,Porsche racecar engineer joins Apple -Manager Magazin
2016/12/16,"EU court ruling on Spanish tax breaks may affect Starbucks, Apple appeals"
2016/12/16,Canadian marijuana companies look to get creative with brand building
2016/12/16,Virtual assistants expected to top virtual reality in holiday sales
2016/12/18,Ireland accuses EU of exceeding power in Apple tax case
2016/12/18,US STOCKS-Wall St extends rally but Germany truck deaths reduce gains
2016/12/19,Wall Street extends rally but Germany truck deaths reduce gains
2016/12/19,"Apple appeals against EU tax ruling, Brussels says no cause for low tax bill"
2016/12/19,US STOCKS-Tech stocks drive Wall Street higher
2016/12/19,US STOCKS-Wall St trims gains after truck kills shoppers in Germany
2016/12/19,Whippocalypse? U.S. ready-made whipped cream in short supply
2016/12/19,Nike CFO- Expect Q3 reported revenue to grow in mid single-digit range
2016/12/20,Apple is discussing manufacturing in India - WSJ citing government officials
2016/12/20,Stakes high as North Carolina considers repealing 'bathroom law'
2016/12/20,EU accuses Facebook of misleading it in WhatsApp takeover probe
2016/12/20,"Nokia sues apple in Europe, U.S. for infringement of Nokia patents"
2016/12/21,"EU reprimands ex-commissioner Kroes, recoups cash"
2016/12/21,"Nokia sues Apple for infringing patents, industry back on war footing"
2016/12/21,EU court says Spanish tax breaks may infringe EU state aid laws
2016/12/21,Nintendo's mobile Mario game sets download record but pricing proves sticking point
2016/12/21,"Eagles pick off Manning three times, dump Giants"
2016/12/22,"Nokia expands patent litigation against Apple in Asia, Europe and U.S."
2016/12/22,U.S. government cancels 9/11-era registry for foreigners
2016/12/22,"Retailers weigh on Wall Street, Dow 20,000 slips away"
2016/12/22,Uber's $70 bln value accrues mainly to customers
2016/12/22,Nokia shares fall on patent dispute with Apple
2016/12/22,Nokia files more patent suits against Apple
2016/12/22,US STOCKS-Wall St weighed down by Apple
2016/12/22,US STOCKS-Wall St falls as investors pause ahead of holiday season
2016/12/22,"US STOCKS-Retailers weigh on Wall Street, Dow 20,000 slips away"
2016/12/22,Icahn regulatory role gives activist investors strong Washington voice
2016/12/23,Last-minute spending surge lifts U.S. holiday shopping season
2016/12/27,"US STOCKS-Dow nears 20,000, Nasdaq hits record as tech stocks rise"
2016/12/27,"US STOCKS-Industrials keep Dow away from 20,000"
2016/12/27,"US STOCKS-Dow nears 20,000, Nasdaq hits record as tech stocks gain"
2016/12/27,Researcher found security holes at smartphone-only bank N26
2016/12/28,US STOCKS-Wall St ends solid 2016 on dour note
2016/12/30,US STOCKS-Wall St set to end strong 2016 on dour note
2016/12/30,Braeburn Pharmaceuticals files for IPO
2016/12/30,Braeburn Pharmaceuticals Inc files for IPO of up to $150 mln - SEC filing
2016/12/30,"GLOBAL MARKETS-Dollar, stocks log yearly gains, oil the biggest winner"
2016/12/30,Swiss watch sector set for smartwatch boom - LVMH executive
2017/1/1,German and French share indexes start 2017 on a weaker note
2017/1/2,European shares hit highs as PMI data comes as New Year's gift
2017/1/2,Australia shares set for a cautious start to 2017
2017/1/2,Apple partner Wistron seeks to expand India smartphone parts plant: government official
2017/1/2,Irish foreign investment head sees firms' Brexit decisions starting in Q2
2017/1/3,Champion Technology clarifies on news report published by Apple Daily
2017/1/3,Apple pulls New York Times app from iTunes store in China
2017/1/4,Apple gets second bite at hold-and-drag patent from Federal Circuit
2017/1/4,"Ford expands Alexa use, heating up auto personal assistant battle"
2017/1/4,Apple confirms $1 bln investment in SoftBank tech fund - WSJ
2017/1/4,India says will consider tax incentives sought by other firms while deciding on Apple
2017/1/5,Apple's App Store generates $20 bln for developers in 2016
2017/1/5,Factbox: Apps removed from Apple's China app store
2017/1/5,Blackstone's new investment tune hits right notes
2017/1/5,Apple's App Store generated $20 billion for developers in 2016
2017/1/5,Apple pulls New York Times apps in China after government request
2017/1/5,Apple says App Store generated over $20 bln for developers in 2016
2017/1/6,"Stocks, dollar recover ground after U.S. jobs report"
2017/1/6,"US STOCKS-S&P, Dow flat after jobs data; tech stocks lift Nasdaq"
2017/1/6,Samsung Electronics forecasts fourth-quarter profit at over three-year high
2017/1/6,Canada's competition watchdog closes two-year Apple probe
2017/1/6,Apple Inc's CEO Tim Cook's total 2016 compensation was $8.7 mln versus $10.3 mln last year
2017/1/6,"US STOCKS-Dow comes within 1 point of 20,000; indexes at records"
2017/1/7,"US STOCKS-Banks, oil stocks hinder Dow's pursuit of 20,000"
2017/1/9,1-Mercedes-Benz overtakes BMW to become largest premium carmaker
2017/1/9,Afghan businesses feel squeeze from government tax drive
2017/1/9,Tesla Motors says Chris Lattner to be VP of autopilot software
2017/1/10,Snapchat becomes latest tech firm to pick London despite Brexit
2017/1/10,China's WeChat seeks slice of Apple's app store with 'mini' function
2017/1/10,Tesla taps Apple engineer for Autopilot software
2017/1/10,Mexico's Pemex says protests cause 'critical' border city fuel shortage
2017/1/10,"Wall Street ends choppy session higher, health lags on Trump comments"
2017/1/11,"Exclusive: Alibaba, part of planned Taiwan fund, won't seek board seats at local firms - source"
2017/1/11,Reuters TV hits 1 million monthly active users
2017/1/11,"US STOCKS-Wall Street ends choppy session higher, health lags on Trump comments"
2017/1/11,"Trump, tech tycoons talk overhaul of high-skilled visa program"
2017/1/12,U.S. appeals court revives antitrust lawsuit against Apple
2017/1/12,"With new leverage, NYC's Stringer could reshape boardrooms"
2017/1/12,"US STOCKS-Dow, S&P set for worst day in three months as Trump-trade fizzles"
2017/1/12,China's Xiaomi targets 2017 sales of $14.5 bln after 2016 business overhaul
2017/1/12,"Taiwan's TSMC Q4 net rises 37.6 pct y\/y to quarterly record, beats estimates"
2017/1/12,"Pandora Media reduces U.S. workforce, will exceed fourth-quarter revenue forecast"
2017/1/12,Treasury Wine wins China trademark dispute for Penfolds flagship
2017/1/12,U.S. appeals court revives antitrust lawsuit against Apple
2017/1/12,US STOCKS-Wall St set for worst day in 2017 as Trump-trade fizzles
2017/1/12,BlackRock CEO says Trump 'tax holiday' may do little for U.S. growth: CNBC
2017/1/13,"9th Circuit Apple antitrust ruling splits with 8th, is boon to consumers"
2017/1/13,Wal-Mart's leadership expands exec roles in online push
2017/1/13,France should sell non-strategic stakes in firms - Fillon
2017/1/13,"US insurers get inside cars, mouths, grocery carts in profit search"
2017/1/16,"Your Money: Your pet is obese, but you pay the price"
2017/1/17,"Greenlight's Einhorn sticks with what he likes, raises stake in GM"
2017/1/17,IBM and Bell transform enterprise mobility in Canada
2017/1/17,"Indian government wants Apple, but not all officials are biting"
2017/1/18,Exclusive: Restaurant chain Chuck E. Cheese prepares IPO - sources
2017/1/18,"Chinese paper warns Boeing, U.S. agriculture in crosshairs of Trump trade war"
2017/1/19,Samsung leads Elliott outside its comfort zone
2017/1/19,"EU antitrust regulators welcome Amazon, Apple audiobook agreement"
2017/1/19,China says can resolve trade disputes with new U.S. government
2017/1/19,"EU antitrust regulators welcome Amazon, Apple audiobook deal"
2017/1/19,Apple sues Qualcomm for roughly $1 bln over royalties - CNBC
2017/1/20,Sony Music seeks Nigeria streaming growth to build on ringback market
2017/1/20,"Canada's Competition Bureau reaches deal with Apple, publishers"
2017/1/20,"Melania Trump's hometown hopes new-found fame will boost trade, tourism"
2017/1/20,Apple files $1 billion lawsuit against chip supplier Qualcomm
2017/1/20,Outgoing FCC chair warns against overturning net neutrality
2017/1/20,"As nuclear loss grows, Toshiba needs chip investors, soon"
2017/1/21,Chief of Taiwan's Foxconn says rise of protectionism unavoidable
2017/1/21,Foxconn CEO says investment for display plant in U.S. would exceed $7 billion
2017/1/22,Samsung Electronics says battery defects caused Note 7 fires
2017/1/22,LG Display reports record fourth-quarter profits; panel prices seen rising further
2017/1/23,"Xiaomi executive Barra, who drove smartphone maker's global push, steps down"
2017/1/23,"Samsung says batteries caused Note 7 fires, may delay new phone launch"
2017/1/23,Foxconn invests in China's Mobike as the start-up plans aggressive expansion
2017/1/23,US STOCKS-Wall St pares losses after Trump meets US company execs
2017/1/23,US STOCKS-Wall St turns defensive on Trump's protectionist stance
2017/1/23,BlackRock to ask if companies spend cash from tax holiday on growth
2017/1/24,"Exclusive: Brazil's Odebrecht says anti-graft backlash threatens fines, public works"
