Date,Title
2007/4/25,"Dow inches closer to 13,000"
2007/4/23,"Dow aims at 13,000"
2007/4/20,Another big week on Wall Street coming
2007/4/19,Big Dow record? Big deal
2007/4/19,Record high caps Dow comeback
2007/4/18,Dow claims highest close on record
2007/4/18,"Dow breaks 12,800, new all-time high"
2007/4/18,Techs drag down Nasdaq
2007/4/18,Dow flirts with new record
2007/4/18,United Tech beats estimates
2007/4/5,Ford CEO: $28M for 4 months work
2007/4/3,Stephen Hawking to ride the 'vomit comet'
2007/3/29,Stocks slump on economic woes
2007/3/28,Stocks slump on economic woes
2007/3/28,Wall Street: worried about the economy
2007/3/20,Anti-war protesters outside of NYSE arrested
2007/3/17,"Stocks: down day, down week"
2007/3/9,Stocks struggle on jobs report
2007/3/9,Stocks gain on jobs report
2007/3/9,Ford paying bonuses to all employees
2007/3/7,Blue chips give back gains
2007/3/7,Blue chips cling to gains
2007/3/7,Market split after big rally
2007/3/3,Stocks: Worst week in 4 years
2007/3/2,"Stocks search for bottom, day 2"
2007/3/2,"Boeing could cut up to 7,000 jobs by '09"
2007/2/27,Brutal day on Wall Street
2007/2/27,"Dow sinks 500, claws back"
2007/2/27,Stock selloff picks up steam
2007/2/27,Stock selloff deepens
2007/2/26,Boeing to fight jamming - report
2007/2/26,Buyout pop for Wall St.
2007/2/23,UPS may nix Airbus A380 order
2007/2/16,Ford memo calls recovery off track
2007/2/16,Wall St. bears enter the house
2007/2/16,Wall St. bears could be in house
2007/2/13,Made in U.S.A.: Record trade gap
2007/2/6,Mixed day on merger news
2007/2/5,"Dow barely gains, Nasdaq retreats"
2007/2/5,Dow fight for gains as Nasdaq struggles
2007/2/5,"Dow drifts, Nasdaq slides"
2007/2/5,Mulally to work at Ford dealership
2007/2/2,Dow hits new all-time high
2007/2/1,Dow hits new all-time high
2007/2/1,Dow heads for record
2007/2/1,Stocks rally post Fed
2007/1/31,Stocks rally post Fed
2007/1/31,"Stocks rally, Dow hits record post Fed"
2007/1/31,"Stocks mixed, wait for Fed"
2007/1/31,Stocks mixed ahead of Fed
2007/1/31,Stocks on the move Wednesday
2007/1/31,Dow up ahead of Fed
2007/1/31,Stocks in a mixed mood
2007/1/31,Mixed ahead of the Fed
2007/1/31,"Companies splitting CEO, chairman roles"
2007/1/31,Stocks get GDP lift
2007/1/31,Stocks rise ahead of Fed
2007/1/24,"Blue chips rise, techs struggle"
2007/1/23,"Blue chips rise, techs struggle"
2007/1/23,Blue chips hold on to gains
2007/1/23,Stocks slump on Wall Street
2007/1/22,Stocks slump on Wall Street
2007/1/22,Monday malaise on Wall Street
2007/1/22,Oil can't stop tech wreck
2007/1/22,Big selloff on Wall Street
2007/1/22,Stocks on the move Monday
2007/1/22,Stock selloff speeds up
2007/1/22,Weak start on Wall Street
2007/1/18,Ford exec grounded from corporate jet
2007/1/11,Bonds continue to tumble
2007/1/8,Wall Street braces for M&A Monday
2007/1/4,"Ford CEO, unions reportedly talking"
2007/1/3,Stock rally fizzles on Fed
2007/1/3,Sizzling start to New Year
2006/12/26,Boeing tops Airbus for first time in 6 years
2006/12/26,Stocks struggle higher in post-holiday trading
2006/12/26,Jingle bells versus oil wells
2006/12/14,The rally's secret leaders
2006/12/12,Airbus A380 said to be safe to fly
2006/12/6,"Jittery on jobs, Yahoo!"
2006/12/6,Shaky morning on Wall Street
2006/12/6,"Techs dip, blue chips drift"
2006/12/6,S&P ends at 6-year high
2006/11/29,Stocks stage a comeback
2006/11/28,Stocks pull it together
2006/11/28,Stocks stage recovery try
2006/11/28,Growth worries clip stocks
2006/11/28,Stocks dip on Bernanke
2006/11/28,Stocks calm after storm
2006/11/28,"Stocks recover, try to rise"
2006/11/28,"Economy, Bernanke comments in crosshairs"
2006/11/28,Wall St.'s worst day in months
2006/11/22,Stocks scratch out some gains
2006/11/21,Stocks scratch out some gains
2006/11/21,Tuesday's late movers
2006/11/21,Stocks struggle to rise
2006/11/21,Stocks muster gains
2006/11/21,Stocks tiptoe higher
2006/11/21,Stocks in jittery trade
2006/11/21,"Higher oil, hesitant stocks"
2006/11/21,Rebounding back to record territory
2006/11/20,The rally's secret leaders
2006/11/17,Dow sets record for 3rd straight day
2006/11/16,Dow flirts with new record
2006/11/16,Dow hovers near record high
2006/11/16,Nobel economist Milton Friedman dead at 94
2006/11/16,Another run at a Dow record
2006/11/16,Blue chips on the rise
2006/11/15,US Air-Delta deal could lift stocks
2006/11/11,Friday's late movers
2006/11/10,"Nasdaq gains, Dow drifts"
2006/11/10,Stocks mixed on earnings
2006/11/10,Tech stocks lead turnaround
2006/11/10,Choppy Friday on Wall Street
2006/11/10,Pumping to a higher open
2006/11/9,"Falling oil, record exports shrink trade gap"
2006/11/9,Dow sets record after vote surprise
2006/11/8,Dow sets record after vote surprise
2006/11/8,Stocks recover after election surprise
2006/11/8,Bulls try to recharge on Wall Street
2006/11/8,Wall Street wobbly post-election
2006/11/8,Stocks mixed after election
2006/11/8,An Election Day advance
2006/11/7,An Election Day advance
2006/11/7,Late Tuesday movers
2006/11/7,Wall Street's Election Day rally
2006/11/7,Election Day rally on Wall Street
2006/11/7,Stocks rally on Election Day
2006/10/27,Nasdaq joins the party
2006/10/26,Nasdaq joins the party
2006/10/26,"Rally resumes, led by tech"
2006/10/26,Stock investors recharge
2006/10/26,Investors edgy after rally
2006/10/26,Stocks retreat on housing woes
2006/10/26,A stock rally about nothing
2006/10/25,Late trading stocks
2006/10/25,Stocks welcome Fed decision
2006/10/25,Stocks improve after Fed
2006/10/25,Stocks primed for Fed
2006/10/25,Stocks whipsawed ahead of Fed
2006/10/25,"Techs rise, blue chips drift"
2006/10/25,Futures point to a mixed open for stocks
2006/10/25,"Dow closes at record, but Nasdaq dips"
2006/10/23,Ford's net loss widens to $5.8B
2006/10/21,"Stocks eye economy, end mixed"
2006/10/6,Hope for new record sinks on jobs report
2006/10/5,Dow: Record high for 2nd day
2006/10/4,Payment to GM tanks talks with Renault-Nissan
2006/10/4,Wal-Mart worries for Dow
2006/10/4,A big day for the Dow
2006/10/4,Dow sets all-time high
2006/10/3,Dow: Maybe a closing record
2006/10/3,Dow: Green light for record
2006/10/3,Dow tries for record again
2006/9/27,Report: Ghosn to pitch GM on $10B savings
2006/9/27,Dow knocking on record's door
2006/9/26,Dow knocking on record's door
2006/9/26,Dow inches closer to record
2006/9/26,Blue chips lead the charge
2006/9/25,"Ghosn, Wagoner to meet"
2006/9/25,Fueling a rally
2006/9/22,Mulally reportedly shaking up Ford
2006/9/20,Rally in the making
2006/9/15,Dow falls short of record
2006/9/15,Dow nears record
2006/9/15,Blue chips lead advance
2006/9/15,Another day of pain at Ford
2006/9/15,Blue chips dip after big rally
2006/9/15,Blue chips slip slightly after runup
2006/9/14,Blue chips slip slightly after runup
2006/9/14,Hanging on to May highs
2006/9/14,Stocks fight for 4-month highs
2006/9/14,GM-Nissan talks may run out of gas
2006/9/14,Blue chips get bruised
2006/9/14,Stocks slip after rally
2006/9/14,Ford's troubled 'Way Forward'
2006/9/14,Stocks weaker on retail sales
2006/9/14,"UAW says Ford offers buyouts to 75,000 workers"
2006/9/14,Wall Street hits four-month highs
2006/9/13,Wall Street hits 4-month highs
2006/9/13,Wall Street flirts with 4-month highs
2006/9/12,Federal Reserve governors grow richer
2006/9/12,Trade gap hits record
2006/9/11,Ford said to eye new job cuts
2006/9/8,Wall Street slides again
2006/9/7,Stocks slide again
2006/9/7,Right back down
2006/9/7,Techs lead recovery try
2006/9/7,Stocks fight back
2006/9/7,Stocks feel end-of-summer blues
2006/9/6,Stocks get the end of summer blues
2006/9/6,"Stocks shrug off Fed, eye inflation"
2006/9/6,Retreating after the run
2006/9/6,A slump after the rally
2006/9/6,Nasdaq leads declines
2006/9/6,Worried about the economy
2006/9/6,Looking for a loss
2006/9/6,"Nasdaq jumps, Dow drifts"
2006/9/6,Ford names new CEO
2006/9/5,"Nasdaq jumps, Dow drifts"
2006/9/1,Wall St. breathes sigh of relief
2006/9/1,NASA: Lockheed Martin to build spacecraft
2006/8/30,Techs rise for fifth straight session
2006/8/30,America's smartest cities
2006/8/29,Wall Street: Minute to minute
2006/8/25,"Techs rise, blue chips dip"
2006/8/18,Stocks pull off a win
2006/8/16,"Stocks rally, day two"
2006/8/11,"Down day, down week"
2006/8/10,Relief on Wall Street
2006/8/10,Airline stocks take hit after terror arrests
2006/8/10,Report: Boeing still faces probe
2006/8/10,U.K. scare to affect Wall St.
2006/8/8,Stocks slip after Fed pauses
2006/7/31,Stocks rocky after the rally
2006/7/26,Rocky day on Wall Street
2006/7/26,It could be a jungle out there
2006/7/25,Honda cars...Honda bikes...Honda jets?
2006/7/25,Stocks stage a comeback
2006/7/19,The Big Ben rally
2006/7/18,Boeing : Still gaining altitude
2006/7/18,Stocks try to shake oil woes
2006/7/17,Oil retreat could help stocks
2006/7/14,"Wall Street battered, day 3"
2006/7/7,Senators balk at tax break on Boeing settlement
2006/6/29,"JetBlue, Continental tops in airline satisfaction"
2006/6/22,British Airways hit by price-fixing probe
2006/6/22,Searching for direction
2006/6/20,Stocks smile on mixed housing news
2006/6/19,8 global giants to watch
2006/6/15,Party on Wall Street
2006/6/14,Stocks pull off fab finish
2006/6/14,Futures plummet on price report
2006/6/6,Devil of a day for the Dow
2006/5/25,What the options saga means to investors
2006/5/18,Next hot market...think Washington
2006/5/18,Military contractors eye $2B in border control contracts
2006/5/16,Mixed up Monday
2006/5/15,Down at the start
2006/5/15,Poised for a fall
2006/5/10,"Federal judge quits, heads to Boeing"
2006/5/9,"For college grads, money isn't everything"
2006/5/7,"Japan, U.S. to develop supersonic aircraft"
2006/5/5,Dow hits fresh 6-year high
2006/5/3,"EU eyes new talks on Boeing , Airbus"
2006/5/3,Stocks back in the high life
2006/5/2,Bernanke on the brain
2006/5/1,Investors come out swingin'
2006/5/1,Chin up ahead of busy week
2006/4/27,Dow jumps to new 6-year high
2006/4/26,Blue chips lead the way
2006/4/26,Stocks set for early pop
2006/4/26,Rate worries back to haunt stocks
2006/4/25,Tenuous Tuesday
2006/4/13,Blue chips lead advance
2006/4/12,Stocks rise at open
2006/4/12,Stocks could slip on oil again
2006/4/12,Boeing inks deal to sell 80 more aircraft to China
2006/4/11,Inflation worries weigh on Wall Street
2006/3/30,Nasdaq hits five-year highs
2006/3/17,Stocks cling to gains
2006/3/16,Stocks near 5-year highs
2006/3/7,A year of big profit for Boeing execs
2006/3/4,"Mixed day, mixed week"
2006/3/1,Tough Tuesday on Wall St.
2006/2/23,Stocks jump as oil falls
2006/2/2,Weaker at the start
2006/2/1,Google weighs on tech
2006/2/1,Blue chips lead a turnaround
2006/2/1,Stocks fall after the Fed
2006/1/28,Big week on Wall Street
2006/1/27,"Make 150,000% Today!"
2006/1/27,GDP posts smallest gain in 3 years
2006/1/27,Big rally on Wall Street
2006/1/17,"Alcoa, Boeing , Disney up for gains today"
2006/1/17,Slippery opening for stocks
2006/1/12,"Recharged rally, 11,000...and beyond"
2006/1/7,Wall Street's New Year's resolution...
2006/1/6,Nasdaq makes it 3 for 3
2006/1/5,Happy tech year continues
2005/12/31,"Down day, tough year"
2005/12/24,"Flat day, mixed week"
2005/12/20,S&P 500: Under-funding retiree health
2005/12/15,Blue chips muscle through
2005/12/14,Honeywell says 2006 growth looks sweet
2005/12/14,On second thought....
2005/12/13,The right CEO for 3M
2005/12/8,3M's search is over
2005/12/1,Xtreme Saver: Clare Cheesman
2005/11/29,Durable goods jump in October
2005/11/22,Read the Fed minutes
2005/11/22,The rally that kept flying
2005/11/21,Getting into gear
2005/11/11,"Stocks rally on oil, bonds"
2005/11/10,Trade gap soars to record
2005/11/2,Wondering about oil
2005/10/29,Big rally on Wall Street
2005/10/27,Demand cracks for durable goods
2005/10/27,Europe stocks lower in early trade
2005/10/27,Stocks suffer setback
2005/10/26,Struggling at the open
2005/10/26,Plane wane
2005/10/24,Bernanke's the man
2005/10/24,Bernanke: A path to the Fed
2005/10/23,Seeking to rally
2005/10/13,Trade gap rises
2005/10/7,Stocks slide again
2005/10/4,"Dow slides, Nasdaq edges up"
2005/9/30,"Three, and out"
2005/9/28,Mixed day on Wall Street
2005/9/27,Stocks struggle back
2005/9/26,Relief rally at open
2005/9/26,The Whew! factor
2005/9/9,Chipper morning
2005/9/3,"Tough day, better week"
2005/9/2,Stocks drift higher on cross-currents
2005/9/2,A job for Wall Street
2005/8/31,Whipsawed on Wall Street
2005/8/30,United looks to China for repairs
2005/8/19,This market's not so dull after all
2005/8/18,Stocks end higher
2005/7/28,Beige book' prods bulls higher
2005/7/27,Dow gains at open
2005/7/27,Buy the book?
2005/7/24,"Earnings blowout, week 2"
2005/7/18,Red storm ahead
2005/7/12,CEO departures on the upswing
2005/7/7,Stocks slide in oil
2005/7/1,Post-Fed slump for stocks
2005/6/30,Cautious buying seen
2005/6/21,Stocks hang tough despite oil rise
2005/6/20,An oily problem for stocks
2005/6/17,The plight of the upwardly mobile
2005/6/15,Blue chips manage gains
2005/6/13,Testing the winds
2005/5/31,"Stocks say ""Non"""
2005/5/31,Europe worries Wall St.
2005/5/27,Solid day on Street
2005/5/26,Bulls on call
2005/5/19,Air France-KLM posts 4Q loss
2005/4/28,Falling oil lifts Dow
2005/4/27,Tough day on Street
2005/4/26,De-fense! De-fense!
2005/4/26,Air-India places $8B Boeing order
2005/4/26,Stocks bounce back
2005/4/25,"Roller coaster, week 3"
2005/4/19,Stocks snap back
2005/4/7,CEO turnover highest since '00
2005/3/29,Pentagon takes Air Force's buying power
2005/3/29,"2 steps forward, 1 back"
2005/3/21,L-3 faces criminal probe
2005/3/15,New ways to get fired
2005/3/9,Kerr-McGee may shed chemical unit
2005/3/8,Nasdaq joins the run
2005/3/7,Boeing CEO out in sex scandal
2005/3/7,Stocks on the rise
2005/3/7,Dow looks toward 11K
2005/3/4,Gearing up for payrolls
2005/3/2,British Air to refocus on customers?
2005/2/25,Stocks stage recovery
2005/2/24,Oil slick part 2
2005/2/23,Stocks eye U-turn
2005/2/9,Lawmakers fight against China trade rule
2005/2/3,Ordering a selloff?
2005/2/3,Stocks shrug off Fed
2005/2/2,Stocks in two day rally
2005/2/1,Slow start for stocks
2005/1/29,Stocks face the storm
2005/1/25,Study: Plane anti-missile cost steep
2005/1/22,"Stocks fall on day, week"
2005/1/19,"Stocks rise, day 2"
2005/1/14,A strong finish?
2004/12/31,"After run, stocks rest"
2004/12/30,Stocks inch higher
2004/12/30,Stocks pull it together
2004/12/23,Stocks boosted by oil
2004/12/22,"Bulls sound off, part II?"
2004/12/15,"FCC eyes in-flight cell phones, Web"
2004/12/15,Market OK's rate hike
2004/12/14,Stocks mixed at open
2004/12/14,Stocks rally anew
2004/12/6,Satellite Radio
2004/11/29,Stock Spotlight - Cisco
2004/11/29,Stock Spotlight - Boeing
2004/11/23,Bears loose on Wall Street?
2004/11/22,Can Boeing fly again?
2004/11/12,Stock rally recharged
2004/11/11,Shrugging off the Fed
2004/11/5,Investors cheer Bush win
2004/11/1,"Bush, Kerry: Who's better for biz?"
2004/10/29,UAL aims for upscale fliers?
2004/10/28,"Falling oil, rising stocks"
2004/10/27,Blue chips back off
2004/10/27,A mix-up for stocks?
2004/10/27,Bulls strut their stuff
2004/10/24,The spooky week ahead
2004/10/22,"""Earnings that matter - October 22, 2004"""
2004/10/11,"Kids, Inc."
2004/10/5,Hanging in there
2004/9/30,"Stocks rise, day two"
2004/9/24,"Dow down, day two"
2004/9/23,Stocks have hangover
2004/9/17,Stocks see the calm
2004/9/9,Nokia calls the bulls
2004/9/9,Stocks to watch Thursday
2004/8/27,Investors eye GDP report
2004/8/26,Oil in pain; stocks gain
2004/8/25,Stocks set to tiptoe up
2004/8/10,Stocks to watch Tuesday
2004/7/29,Dow manages a comeback
2004/7/28,Oily risk to stocks
2004/7/28,Stocks to watch Wednesday
2004/7/28,Bulls strut on Street
2004/7/26,Upbeat start for stocks
2004/7/24,"Tough day, tough week"
2004/7/23,"Earnings: 8 matter, 2 don't"
2004/7/7,Oil could pump up stocks
2004/7/2,Stocks to watch Friday
2004/7/2,Stocks get pummeled
2004/7/1,"Stocks up on day, month, quarter"
2004/6/29,"Stocks rally, retreat"
2004/6/16,Stocks bounce on CPI
2004/6/15,Stocks jump at open
2004/6/15,Tame inflation to boost stocks
2004/6/15,Wall Street sees red
2004/6/15,Stocks to watch Tuesday
2004/6/8,Stocks' scorching Monday
2004/6/3,"Blue chips: Thanks, OPEC"
2004/6/2,Stocks lubed for gains
2004/6/1,Oily worries for stocks
2004/5/29,Stocks end little changed
2004/5/28,Stocks lead as oil bleeds
2004/5/27,"Nasdaq rallies, Dow drifts"
2004/5/26,Stocks slip in early going
2004/5/26,Stocks' fear factor
2004/5/26,Stocks to watch Wednesday
2004/5/4,Stocks await Fed
2004/5/4,Markets rally pre-Fed
2004/5/4,"Tech weakens midday, indexes mixed"
2004/4/28,Stocks under siege
2004/4/28,Stocks slide at open
2004/4/28,Plug pulled on stocks
2004/4/28,Stocks to watch Wednesday
2004/4/28,Solid profits fail to boost techs
2004/4/27,Market's mopey Monday
2004/4/26,Stock edge up at open
2004/4/26,"Stocks eye drugs, homes"
2004/4/23,Rip-roaring rally
2004/4/13,Market bets on strong 1Q
2004/4/9,A low-fare business class seat
2004/4/8,Rally brewing Thursday?
2004/4/8,Stocks to watch Thursday
2004/4/7,Stocks fizzle at open
2004/4/7,Stocks to watch Wednesday
2004/4/7,Nasdaq breaks win streak
2004/3/31,Win a Porsche! Click here!
2004/3/20,Tech stocks drop again
2004/3/1,UPS in Talks to Cancel Airbus Orders
2004/2/28,"Mixed day, week, month"
2004/2/27,"Nasdaq gains, Dow wanes"
2004/2/27,Techs manage modest gains
2004/2/25,Market down 5 for 5
2004/2/24,Nasdaq knocked back
2004/2/20,Update: America's best stocks
2004/2/6,Stocks edge higher
2004/1/30,Dow stages recovery
2004/1/29,Stocks bounce at open
2004/1/29,Wall St.'s patience test
2004/1/29,Fed spooks the market
2004/1/29,Stocks to watch Thursday
2004/1/28,Stocks to watch Wednesday
2004/1/27,Stocks to watch Tuesday
2004/1/15,Stocks strike higher
2004/1/14,How high the moon?
2003/12/31,Mixed day on Wall Street
2003/12/30,Bulls face economy test
2003/12/30,Stocks to watch Tuesday
2003/12/29,Best of Street Life 2003
2003/12/22,European stocks close mostly in red
2003/12/18,For sale soon: trips to space?
2003/12/16,AirTran's quick-change act
2003/12/13,Dow surges anew
2003/12/12,How high the moon?
2003/12/12,"Starting point: Dow 10,008"
2003/12/9,"Dow nears 10,000 pre-Fed"
2003/12/3,"And now, some profit-taking"
2003/12/2,Boeing CEO out
2003/12/2,Holiday cheer
2003/12/2,Market rallies anew
2003/12/2,Techs start the week higher
2003/12/1,Stocks surge at open
2003/12/1,"Check it out, Wall St!"
2003/11/27,Wall Street sings 'thanks-for-giving'
2003/11/25,Stocks bounce back
2003/11/25,Stock rally revved anew
2003/11/24,Stocks gain at open
2003/11/19,Stocks suffer selloff
2003/11/12,GM to ship cars to China
2003/11/11,GM to ship cars to China
2003/10/30,GDP rocks futures
2003/10/30,China syndrome
2003/10/30,Stocks manage gains
2003/10/29,Boeing flies over 3Q target
2003/10/29,Stocks pull back at open
2003/10/29,Stocks set to pull back
2003/10/29,Stocks to watch Wednesday
2003/10/28,Boeing still faces turbulence
2003/10/26,Six reports that matter
2003/10/17,As good as it gets for wireless?
2003/10/1,Smackdown on the Street
2003/9/29,Monday's stocks: Boeing
2003/9/23,Weak dollar dents the Dow
2003/9/11,Techs drag the market down
2003/9/10,"Up, up and...down"
2003/9/6,"Strong week, weak day"
2003/9/2,Stocks to watch Tuesday
2003/9/1,E-mails raise questions on Boeing lease
2003/8/23,"Down day, up week"
2003/8/9,Bob McKnight
2003/8/8,Go Wal-Mart! Go blue chips!
2003/7/25,Stocks to watch Friday
2003/7/23,Stocks dip at open
2003/7/23,"AOL, Amazon in focus"
2003/7/23,Market charges ahead
2003/7/19,The bulls stop to graze
2003/7/19,Stocks jump higher
2003/7/19,Harold 'Terry' McGraw III
2003/7/19,Three-week winning streak
2003/7/16,Greenspan hurts stocks
2003/7/16,King of the Hill
2003/7/15,Stocks in mixed action
2003/7/3,Lost jobs eat at stocks
2003/7/2,Solid start to the second half
2003/7/1,Stocks slide at open
2003/7/1,Wall St. enters 2nd half
2003/6/21,George David
2003/6/17,Bulls stage stampede
2003/6/16,Stocks bounce at open
2003/6/16,Stock futures recover
2003/6/16,Ford Cars
2003/6/12,Stocks bounce at open
2003/6/12,Stocks primed to rise
2003/6/11,"Bye, Sam. Hello, Bull!"
2003/6/7,Matrix: big test for Imax
2003/6/5,Should Martha step down?
2003/5/24,The dark before the dawn?
2003/5/7,Naked Air' takes off -- all of it
2003/5/7,Naked Air' takes to the skies
2003/5/6,"Fed, Cisco at forefront"
2003/5/6,Nasdaq keeps the gains
2003/5/5,Dow does U-turn
2003/5/5,Markets set to rise
2003/5/3,Stocks seize the day
2003/5/1,Springtime for stocks
2003/4/29,Upbeat earnings drive stocks up
2003/4/28,Street Talk: Boeing downgrade
2003/4/24,Stocks score gains
2003/4/23,Stocks stagger at open
2003/4/23,Stocks cheer results
2003/4/23,Rally on Wall Street
2003/4/19,7 earnings reports that matter
2003/4/18,Wall Street advances
2003/4/14,Street Talk: airlines
2003/4/12,Discomfort weighs on Wall St.
2003/4/12,Another flat Friday
2003/4/12,The future of flight
2003/4/11,Stocks look up
2003/4/11,Stocks to watch Friday
2003/4/11,Boeing to take $1.2 billion charge
2003/4/10,Back to the home front
2003/4/3,The future of flight
2003/3/27,The new Sears
2003/3/27,Stocks worried by war
2003/3/20,Tech to play big role in Iraq
2003/3/19,"Stocks eye war, not Fed"
2003/3/18,"Stocks focus on war, ignore Fed"
2003/3/7,Anxiety slays stocks
2003/3/6,Jobless claim jitters
2003/3/6,"All Iraq, all the time"
2003/3/6,Markets muster gains
2003/3/5,European Markets End Lower
2003/2/27,"War, oil sink stocks"
2003/2/21,Stagflation? You Must Be Kidding!
2003/2/4,Stocks look to Cisco
2003/2/4,A Monday in Mourning
2003/2/3,Shuttle contractor stocks lower
2003/2/3,A shift into green
2003/2/1,"Good day, bad month"
2003/2/1,"It's the threat of war, stupid"
2003/1/31,"Dow sinks back below 8,000"
2003/1/31,Roundup: Disney profit falls
2003/1/30,"Boeing warns for '03, '04"
2003/1/30,Stocks struggle at open
2003/1/30,Easing tensions
2003/1/30,Stocks muster a gain
2003/1/30,Stocks to watch Thursday
2003/1/25,Wall Street walloped
2003/1/23,Eight earnings reports that matter
2002/12/24,Hot Stocks: Boeing rises
2002/12/14,Bidders eye UAL
2002/12/10,"Boeing , Gen'l Dynamics win reprieve"
2002/12/10,United hits turbulence of bankruptcy
2002/12/7,Stocks edge higher
2002/12/6,Bulls retreat
2002/12/6,What's next for United?
2002/12/3,A herd shot round the world...
2002/11/23,Dow's lucky 7
2002/11/21,A battle plan for your portfolio
2002/11/18,"All eyes on Iraq, UAL"
2002/11/14,United bankruptcy deadline: Dec. 2
2002/11/13,Boeing union backs offer
2002/11/13,Boeing offers engineers pay hikes
2002/11/12,"Boeing , union near end of talks"
2002/11/7,"Stocks rise on Fed, look to Cisco"
2002/11/6,Dow rises ahead of Fed
2002/11/5,Hot Stocks: Boeing lifted
2002/11/5,Stock rally in transit
2002/11/2,Markets face more tests
2002/10/30,Maybe there's hope after all
2002/10/29,Stock markets turn timid
2002/10/25,Markets slide at open
2002/10/25,Gains may not be durable
2002/10/22,Bulls charge again
2002/10/19,Two-week win streak
2002/10/19,The bear is dead
2002/10/18,3Q earnings: Hot or not?
2002/10/18,Stocks poised to decline
2002/10/18,Stocks to watch Friday
2002/10/17,"Delta to cut up to 8,000 jobs"
2002/10/17,Bulls rarin' to rally
2002/10/17,Roundup: IBM beats; AMD loss widens
2002/10/17,Resuscitating the rally?
2002/10/17,No party of five
2002/10/16,"Boeing hits 3Q target, lowers guidance"
2002/10/16,End of the line?
2002/10/15,Rally on hold
2002/10/14,Hot Stocks: Silgan sinks
2002/10/14,Boeing loses key order
2002/10/14,Stocks pull back
2002/10/14,Bali bombing weighs
2002/10/12,Stocks snap losing streak
2002/10/10,A battle plan for your portfolio
2002/10/10,Woes grow despite port reopening
2002/10/10,Stocks under attack
2002/10/9,GE cutting jobs
2002/10/8,Send in the Dramamine
2002/10/5,How bad can it get?
2002/10/5,It's raining warnings!
2002/10/5,Boeing warns on 3Q
2002/10/4,Stock picks by the pros
2002/9/21,Draining week for stocks
2002/9/20,Swing and sway
2002/9/20,Stocks start modestly higher
2002/9/20,Rarin' to recover
2002/9/20,How to play good defense
2002/9/19,Stock picks by the pros
2002/9/17,Mixed picture for stocks
2002/9/16,Stocks swing at the start
2002/9/16,Droopy stock start seen
2002/9/14,Boeing strike averted
2002/9/14,"Mixed day, volatile week"
2002/9/13,Strike could ground Boeing
2002/9/13,Honeywell shares tumble 15%
2002/9/13,Lucent trips futures
2002/9/12,Ford to expense options
2002/9/9,Union set for Boeing strike vote
2002/9/7,Divorce duel reveals Welch's perks
2002/9/5,Boeing tells feds it won't budge
2002/9/5,Stocks pull off a rally
2002/9/4,Iraq concerns cramp stocks
2002/9/4,Chip hurdles
2002/9/4,Stocks to watch Wednesday
2002/9/4,"Boeing , mediators meet"
2002/8/31,Stocks dip at the close
2002/8/30,Boeing union to hold new vote
2002/8/30,No Sun-shine on Street
2002/8/30,Boeing strike on hold -- for now
2002/8/30,A choppy day on Wall Street
2002/8/29,Businesses still paying for 9/11
2002/8/29,Economic data could hit stocks
2002/8/29,Bruising session for stocks
2002/8/28,Techs could slide anew
2002/8/28,"Boeing , union near strike"
2002/8/26,Hot Stocks: UPS drags
2002/8/22,Techs beat back the bear
2002/8/16,Dow forges dip
2002/8/15,Pledge day
2002/8/15,Go Nasdaq
2002/8/15,Hot Stocks: Network Appliance jumps
2002/8/14,Stocks knocked by Fed
2002/8/13,SEC deadline for CEOs nears
2002/8/13,American Air to fly leaner
2002/8/13,Techs take control
2002/8/8,Two for the bulls
2002/7/29,Airbus to pass Boeing
2002/7/27,Wall Street's wild ride
2002/7/23,"Boeing , union clash on jobs"
2002/7/22,Boeing Net service set for takeoff
2002/7/19,Leading the earnings parade
2002/7/18,Dow snaps losing streak
2002/7/18,Whiplash!
2002/7/18,Hot Stocks: Boeing rises
2002/7/17,Dow gains gone
2002/7/17,Super surge for stocks
2002/7/17,Futures ride earnings wave
2002/7/17,Boeing flies over 2Q target
2002/7/17,Stocks to watch Wednesday
2002/7/17,Stocks take an afternoon dive
2002/7/17,Hot Stocks: Nextel surprise
2002/7/14,Stocks ready to chill?
2002/7/11,Boeing forms defense unit
2002/7/2,US Airways defers payments
2002/6/28,Stocks take charge
