Date,Title
2017/2/24,Trump rally: CEOs of Dow companies make $400 million
2017/2/24,Has my pilot had too much to drink? It depends where you fly
2017/2/23,What Boeing's new 737 Max 9 has under the hood
2017/2/23,"Wow, Dow! Market hits 10th straight record high"
2017/2/22,Airbus says it has received 'oral assurances' on Brexit
2017/2/21,Panda's first flight: FedEx sends Bao Bao to China
2017/2/17,Trump: Air Force One looks great at 30
2017/2/17,Trump and jobs: A running fact check
2017/2/17,How Boeing got on Trump's good side
2017/2/17,Samsung arrest; Trump visits Boeing ; Investors pause
2017/2/15,Boeing workers in South Carolina overwhelmingly reject union
2017/2/15,Harrison Ford's plane involved in airliner mishap
2017/2/14,India: Hundreds of 'ghost airports' hold back aviation boom
2017/2/14,Big union vote coming at Boeing plant that Trump may visit
2017/2/13,Superjumbo airline Emirates thinking smaller again
2017/2/10,Trump's expert on aviation? His personal pilot
2017/2/9,Trump faces delicate balancing act between U.S. and foreign airlines
2017/2/9,Emirates Airline: We support more than a million U.S. jobs
2017/2/9,Boeing wants to cash in on India's military spending spree
2017/2/9,Aviation execs carrying wish list to Trump meeting
2017/2/7,American airlines want Trump to take on their Gulf rivals
2017/2/6,Qatar Airways claims record for world's longest flight
2017/2/4,Trump's move on Iran could cost jobs at Boeing
2017/2/3,Elon Musk is taking his travel ban objections directly to Trump
2017/2/3,Uber CEO drops out of Trump's business advisory council
2017/2/2,Norwegian eyes low-cost airline pact with Ryanair and Easyjet
2017/1/31,U.S. does $220 billion in trade with Muslim countries
2017/1/27,Trump launches manufacturing initiative with business leaders
2017/1/27,Norwegian leapfrogs Southwest as first 737 Max operator
2017/1/26,It's a long march to equality for women of color
2017/1/26,Boeing pitches China facility as Trump-friendly
2017/1/25,American Airlines eliminating in-seat screens on new jets
2017/1/25,Trump builds a wall; Investors cheer; Earnings galore
2017/1/24,Trump meets the Big 3; Earnings bonanza; Brexit ruling
2017/1/23,Japan's first passenger jet delayed by another 2 years
2017/1/22,Trump's first week; Samsung answers; Loads more earnings
2017/1/20,Investors await Trump inauguration; Drugs battle; GE earnings
2017/1/19,"Trump market rally on hold, but it may not be over"
2017/1/18,The biggest winners and losers from Trumponomics
2017/1/18,Trump Commerce pick Wilbur Ross keeping some of his empire
2017/1/17,Congressman renews push that could kill Iran jet deals
2017/1/15,Trump inauguration; Time for Davos; Wilbur Ross confirmation
2017/1/13,Boeing snags $11 billion order from India's SpiceJet
2017/1/12,Trump's big challenge: Cutting federal workers
2017/1/12,Boeing chases airlines for stretch 737
2017/1/12,Queen jumbo 747 heads for U.S. retirement this year
2017/1/11,Trump: Drug companies 'getting away with murder'
2017/1/11,Airbus isn't giving up on its A380 superjumbo
2017/1/6,Boeing sales decline despite late buying spree
2017/1/5,Retailers hurting; Government vs. Google; Corona on tap
2017/1/4,End of the auto boom; Exxon in focus; Fed minutes on tap
2017/1/3,2017 starts with a bang; Oil spikes; Techies flock to CES
2017/1/1,New Congress sworn in; Jobs report; 2016 auto sales; India's new bank notes
2016/12/28,The world's new planes in 2017
2016/12/28,Airbus delays A380 deliveries as superjumbo woes mount
2016/12/28,Toshiba shares plummet; Qualcomm in trouble; Aviation watch
2016/12/27,Trump rally could hit speed bump in 2017
2016/12/26,Iran says Boeing deal will cost just $8 billion
2016/12/25,"The quest for 20,000; Retail's last stand; Trump tweet watch"
2016/12/24,Lockheed Martin CEO promises Trump she'll cut F-35 costs
2016/12/23,How Trump's attacks threaten some big job creators
2016/12/23,Stocks react to bank bailout and fines; Lockheed stung; Dow record still in sight
2016/12/23,Trump uses Boeing Super Hornets to sting Lockheed
2016/12/23,Airbus ponders a future with a flying Starbucks and no view
2016/12/22,Boeing CEO vows to keep Air Force One costs below $4 billion
2016/12/21,Trump's new plan to save jobs
2016/12/20,Merry Christmas: You're fired!
2016/12/20,Boeing : More job cuts coming In 2017
2016/12/19,Boeing shoots a plane into the air like a rocket
2016/12/19,Iran drops plan to buy Airbus superjumbo
2016/12/16,CEO who voted for Trump likes what he sees so far
2016/12/16,"Boeing : 150,000 American aviation jobs depend on China"
2016/12/14,Alaska Air and Virgin America are now one
2016/12/14,British Airways braces for pre-Christmas strike
2016/12/13,Boeing's Iran deal won't prevent production cut
2016/12/12,Donald Trump to CEOs: Look out
2016/12/12,Trump calls fighter jet costs 'out of control'
2016/12/12,Oil surges; Travel stocks slammed; Exxon CEO in the spotlight
2016/12/12,The world's first non-stop flights between Australia and Europe are coming
2016/12/11,Boeing sells 80 jets to Iran Air
2016/12/11,Boeing sells 80 jets to Iran Air in biggest U.S.-Iran deal since 1979
2016/12/9,"Trump & Boeing : It's not about Air Force One, it's about China"
2016/12/9,Good to be on Trump blacklist. Stocks he bashed soar
2016/12/8,The Trump rally: It's stunning and it's broad
2016/12/7,"Dow zooms over 1,200 points since Trump victory"
2016/12/7,Trump and Boeing CEO talk about threat to cancel Air Force One program
2016/12/6,Donald Trump says he sold all his stocks in June
2016/12/6,Why Air Force One needs an update
2016/12/6,American CEOs are thrilled with Trump
2016/12/6,Deal for new Air Force One was announced in 2015
2016/12/6,Trump: Air Force One costs 'out of control'
2016/12/6,Trump wants to cancel Air Force One order from Boeing
2016/12/2,Trump taps top CEOs for their views on the economy
2016/11/29,"Next stop for the Dow: 20,000"
2016/11/28,Boeing tax package ruled illegal by WTO
2016/11/22,"Boeing reorganizes into three parts: Airliners, fighters and spare parts"
2016/11/17,8 reasons why starting a trade war with China is a bad idea
2016/11/16,"Want to earn $300,000 tax free? Try flying a plane in China"
2016/11/10,Trump could hit Iran with sanctions -- but Europe would scream
2016/11/9,Middle East execs hope Trump will forget anti-Muslim talk
2016/11/8,Singapore Airlines shops for world's longest jet
2016/11/7,World's biggest twin-engine jetliner has foldable wings
2016/11/5,$73 million Bombardier jet makes first flight
2016/11/4,U.S. airlines look to fill the wide gulf in cabin classes
2016/10/28,UPS gives Boeing's 'Queen' a reprieve
2016/10/25,Designing the workplace of the future: Virtual reality and 3D panoramas
2016/10/25,Earnings deluge; Apple of my eye; Twitter in focus
2016/10/25,Aviation giant Rockwell Collins to buy B/E Aerospace
2016/10/23,AT&T and Time Warner ink a massive deal; Big (Apple) Mac event; Earnings mega-week
2016/10/21,Bombardier announces another round of steep job cuts
2016/10/21,Airbus offers a peek at its flying taxi
2016/10/20,The manufacturing boom that Donald Trump ignores
2016/10/18,Airbus CEO vows to to retake jet production crown from Boeing by 2020
2016/10/15,Trump campaign fact check: Armrests in first class seats did move
2016/10/14,Bank earnings; Chinese inflation; Samsung's losses soar
2016/10/14,Boeing eyes China focus with new sales chief
2016/10/5,"Sorry, Elon Musk! Boeing says it will win race to Mars"
2016/9/30,Donald Trump's last press conference was on July 27
2016/9/22,A faster way to make an airplane
2016/9/21,Boeing and Airbus get US green light to sell planes to Iran
2016/9/13,Samsung won't be the last to have exploding batteries
2016/9/13,"China to spend $1 trillion on 6,810 new aircraft"
2016/9/12,Jeff Bezos' Blue Origin plans massive rocket for its first orbital flights
2016/9/6,British Airways computer glitch causes big delays at multiple airports
2016/9/1,Japanese airline to replace 100 engines on its 787 Dreamliners
2016/8/31,Boeing's 'Father of the 747' has died
2016/8/29,Japan's first passenger jet had a nightmare weekend
2016/8/29,China's new plan to build a world-class aircraft engine
2016/8/17,Check out Delta's new all-suite business class
2016/8/8,Airbus faces criminal corruption probe in Britain
2016/8/3,"Dubai airport handles 200,000 passengers a day"
2016/7/29,What's holding up Iran's big airplane deals
2016/7/29,Iran's deal with Boeing is going nowhere
2016/7/28,Boeing could kill production of its iconic 747 jumbo jet
2016/7/27,Stocks: 5 things to know before the open
2016/7/14,Airbus launches booking site for travelers who love A380 jets
2016/7/14,Chinese hacker found guilty of stealing defense tech sentenced
2016/7/13,Airbus cuts production of A380 super jumbo
2016/7/11,"Boeing to create 2,000 new jobs in the U.K."
2016/6/27,Are central banks 'powerless' to handle Brexit fallout?
2016/6/21,Boeing deal will send 100 new jetliners to Iran
2016/6/21,Stocks: 5 things to know before the open
2016/6/21,Are Chinese hackers dialing back attacks on the U.S.?
2016/6/15,Iran: We've reached a deal to buy planes from Boeing
2016/6/10,Why China wants U.S. military jet engines
2016/6/6,American Airlines thinks it found faster inflight Internet
2016/6/1,This outfit is teaching Syrian refugees how to code
2016/5/23,20 stocks the 'smart money' is betting against
2016/5/23,Stocks: 5 things to know before the open
2016/5/18,Meet the people behind Uber's big Chinese rival
2016/5/12,Boeing falls behind SpaceX in next space race
2016/4/29,Amazon shares soar on fourth straight profitable quarter
2016/4/28,Delta buys 75 new Bombardier jets
2016/4/28,SpaceX just landed a coveted $83 million military contract
2016/4/27,Stocks: 6 things to know before the open
2016/4/12,Boeing working to drum up business in Iran
2016/4/7,Airbus hopes to launch hybrid passenger planes by 2030
2016/4/7,American manufacturing isn't dead yet
2016/4/6,Here comes the worst earnings season since Great Recession
2016/3/30,"Boeing is cutting 4,000 jobs"
2016/3/24,Chinese man admits to cyber spying on Boeing and other U.S. firms
2016/3/14,Iran to U.S. oil companies: We want your money
2016/3/10,Amazon to take air with 20 Boeing cargo planes
2016/3/9,Low-cost airline Ryanair launches private jet service
2016/3/3,Who's ready for a self-cleaning airplane bathroom?
2016/3/3,Your next flight could have a self-cleaning bathroom
2016/3/3,MH370: Time is running out for families to take legal action
2016/2/24,Lithium-ion batteries banned as cargo on passenger planes
2016/2/19,NASA gets record number of astronaut applications
2016/2/17,Airbus CEO upbeat on future of A380 after new orders
2016/2/16,America is missing out on a $1.4 trillion Latino business opportunity
2016/2/11,Boeing stock is tumbling on a 747 accounting probe report
2016/2/9,"Iran wants to be paid in euros, not U.S. dollars"
2016/2/5,Airline's unusual problem: It doesn't know where its passengers are
2016/1/27,Boeing tanks on poor outlook for new planes
2016/1/27,Oil and Apple sour stock market mood
2016/1/25,Iran wants to buy 500 planes and resume flights to U.S.
2016/1/25,McDonald's sales soar thanks to all day breakfast
2016/1/22,Boeing again slashes production of its iconic 747
2016/1/21,United buying 40 new 737-700s to upgrade fleet
2016/1/20,Don't watch this if you're afraid of flying
2016/1/18,Will Iran get McDonald's now?
2016/1/15,Apple's board calls diversity proposal 'unduly burdensome and not necessary'
2016/1/12,"NSA is world's best hacker thief, says former director"
2015/12/10,This is the plane you'll be flying on for the next 30 years
2015/12/4,Virgin Galactic 747 will launch rockets into space
2015/12/2,Who is Priscilla Chan?
2015/11/24,Jeff Bezos' rocket lands safely after space flight
2015/11/23,Britain buying Boeing planes to counter ISIS and Russia
2015/11/21,SpaceX gets mission to take NASA crew to space station
2015/11/20,Elon Musk's SpaceX set to get its first military contract
2015/11/16,War on ISIS' stocks rise after Paris attacks
2015/11/5,NASA to award new International Space Station supply contract
2015/10/29,Airbus sells $17 billion worth of jets to China
2015/10/28,Stealth bomber win lifts Northrop to all-time high
2015/10/27,These stocks are surprising market winners
2015/10/27,Google has 3.8 million GB of our photos (at least)
2015/10/21,Stocks: 6 things to know before the open
2015/10/17,Dow Jones denies report that it was hacked for trading tips
2015/10/14,Boeing says it created lightest metal ever
2015/10/5,See a Boeing Dreamliner built in under 2 minutes
2015/9/23,China President Xi Jinping meets with Big Tech execs
2015/9/23,Xi Jinping: China is ready to address cybercrime
2015/9/21,What is China's president doing in Seattle?
2015/9/15,GE may shift up to 500 jobs overseas due to Ex-Im bank closing
2015/9/2,FAA approves fleet of 324 commercial drones
2015/8/23,Donald Trump is no fan of Politico but likes the Washington Post
2015/8/11,Traders made millions on stocks after hacking press releases
2015/8/10,Warren Buffett does his biggest deal ever: $37.2 billion
2015/8/10,Warren Buffett reportedly close on latest big buy
2015/7/31,MH370: Families still not ready to accept compensation
2015/7/31,Facebook built a giant Internet drone
2015/7/27,U.S. companies with the most to lose in China
2015/7/22,"JFK, LaGuardia workers set to strike Wednesday"
2015/7/22,Old' companies top Apple
2015/7/22,"Take that, tech! Boeing and Coke get it done"
2015/7/22,Stocks: 5 things to know before the open
2015/7/21,"The world needs more pilots: 28,000 new jobs a year"
2015/7/20,6 biggest threats to the stock market
2015/7/16,Donald Trump's best stock picks
2015/6/26,Boeing CEO's retirement package soars to $59 million
2015/6/24,Lawsuit: Boeing jets flood cabin air with toxic fumes
2015/6/24,Boeing names new CEO
2015/6/15,Marine One and Black Hawk helicopter maker for sale
2015/5/29,Bond investing risks
2015/5/19,Top 10 best cities for jobs
2015/5/6,SpaceX Dragon passenger capsule passes key test
2015/5/5,SpaceX Dragon passenger capsule due to get key test
2015/5/1,Airbus wants answers from Germany over U.S. spying claims
2015/4/30,Amazon founder Jeff Bezos' space company launches first rocket into space
2015/4/22,Stocks: 5 things to know before the open
2015/4/20,Tech isn't just for nerdy boys with glasses
2015/4/17,R2-D2 takes flight on Japanese airliner
2015/4/17,"Fearing United plane was hacked, FBI pulls security expert off flight"
2015/4/15,Southwest plane seats are getting wider
2015/4/14,The rocket built to take down Elon Musk
2015/4/11,Brian Grazer and Ron Howard working on space series with Elon Musk
2015/4/7,9 slides that explain Facebook's 10-year strategy
2015/3/31,Airlines drop flights to cash-starved Russia
2015/3/27,Would pilotless planes make sense?
2015/3/24,Crashed Germanwings 9525 operated by Lufthansa's budget airline
2015/3/17,Low-cost airline plans $15 flight to Europe
2015/3/16,This is the U.S. dollar's fastest rise in 40 years
2015/3/8,Private colleges with the biggest payoff
2015/3/6,Apple to FINALLY join Dow. It's about iTime!
2015/2/4,Fly business class to London for 50% less
2015/2/3,Looking for a good job? Try these cities
2015/1/30,Visa is making a killing on fees
2015/1/28,Stocks: 5 things to know before the open
2015/1/27,This Chinese brand is worth more than Alibaba
2015/1/23,McDead? More lousy results from McDonald's
2015/1/6,The strong dollar punishes these companies
2014/12/11,Are the Super Jumbo's days numbered?
2014/12/10,6 ugly stocks that look sexy in 2015
2014/11/26,Supersonic jets can fly from New York to L.A. in 2.5 hours (or less)
2014/11/25,"Drone pilot wanted: Starting salary $100,000"
2014/11/18,Southwest Airlines: Top stock of 2014
2014/11/2,GOP win could spark party on Wall Street
2014/10/30,Why are America's biggest businesses struggling?
2014/10/29,Exploding rocket company's stock plunges
2014/10/22,Stocks: 4 things to know before the open
2014/10/19,Nightmare on Wall Street: Is it over?
2014/10/1,Top 10 companies lobbying Washington
2014/9/29,India's new prime minister to corporate America: Come to India
2014/9/25,India's $74 million Mars mission cost less than 'Gravity' movie
2014/9/18,Elon Musk: From space race to space war
2014/9/18,Why NASA is turning to Elon Musk
2014/9/17,Boeing & SpaceX win the business of space
2014/9/17,See Boeing's new passenger space craft
2014/9/17,"Boeing , Space X land NASA contracts"
2014/9/16,"Boeing , Space X land NASA contracts"
2014/9/15,The richest middle class ... that isn't near NY and DC
2014/9/10,Colleges with the highest-paid grads
2014/8/28,"Inside a $60,000 vacation of a lifetime"
2014/8/20,3 charts that explain the market rebound
2014/8/19,Is it safe to hire?' Business owners don't trust recovery
2014/8/14,"Ferguson's economy: Tough times, but with signs of progress"
2014/8/6,6 companies behind the drone revolution
2014/8/4,Remember PeoplExpress? That name is back in the sky
2014/8/4,Sanctions ground oligarch's Gulfstream jet
2014/7/31,Sanctions hit Russian oil and banks
2014/7/23,That was fast. New record for stock market
2014/7/23,Nothing can ground Delta. Earnings fly
2014/7/23,Stocks: 4 things to know before the open
2014/7/22,Sanctions: Top 10 Russian targets
2014/7/18,World markets slip after plane crash
2014/7/17,Malaysia Airlines may need government rescue
2014/7/15,Stocks: 4 things to know before the open
2014/7/14,Watch Boeing's CEO trash talk Airbus
2014/7/8,Congress wants to clobber my company
2014/6/30,"What's next for Alan Mulally, the man who saved Ford"
2014/6/30,"My job is super stressful and it pays badly, too'"
2014/6/24,Is this government agency worth saving?
2014/6/23,No. 2 Republican hates Export-Import bank
2014/6/11,Elon Musk woos Congress with space ship
2014/6/10,Google should hire me'
2014/6/1,Crazy requests for the luxury concierge
2014/5/30,I work in fast food and I'm not a teenager
2014/5/29,GM made $22.6 billion. We lost $10.6 billion
2014/5/20,China's long history of spying on business
2014/5/9,Friday Links
2014/5/1,"Mulally, CEO who saved Ford, retiring"
2014/4/28,MH370 families want answers from Boeing
2014/4/25,Elon Musk's SpaceX will sue U.S. over rocket contract
2014/4/23,Stocks: The win streak is over
2014/4/23,Stocks: Waiting for big tech earnings
2014/4/22,"Move over Facebook, Alibaba's mega IPO is coming"
2014/4/22,Reports: Ford decides CEO succession
2014/4/1,Judge dismisses Flight 370 legal action
2014/3/26,"First legal steps taken against Malaysia Airlines, Boeing"
2014/3/26,Malaysia Airlines Flight 370: How much will families be paid?
2014/3/25,"Malaysia Airlines' $5,000 payment is just the beginning"
2014/3/24,Tesla tops Google in March Stock Mania
2014/3/24,Meet America's oldest bike maker
2014/3/21,Passengers' families could collect millions
2014/3/18,How the computers on a 777 work
2014/3/14,In the cockpit of a Boeing 777 simulator
2014/3/13,Boeing 777 now under the microscope
2014/3/10,More trouble for Boeing's Dreamliner
2014/3/10,Markets hit pause as investors watch Asia
2014/3/10,Stocks: Are the bulls hungover?
2014/3/8,Boeing reports wing cracks on Dreamliners
2014/3/7,Boeing to end pensions for non-union workers
2014/2/27,Boeing to sell phone that can self-destruct
2014/2/13,8 stocks you love
2014/1/31,Will Obama's pledge get the unemployed back to work?
2014/1/29,Boeing stock gets grounded
2014/1/29,"Stocks sink on Fed, emerging market fears"
2014/1/29,Stocks: Losing momentum ahead of Fed
2014/1/29,State of my economy
2014/1/28,Is McDonald's doomed?
2014/1/28,Top 10 cities people are moving to
2014/1/27,FAA orders inspections of Boeing 767s
2014/1/26,Will stocks break out of their rut?
2014/1/24,Do cry for me Argentina? Peso plunges
2014/1/21,Snow can't stop hot airline stocks
2014/1/9,Tencent: China's hottest tech company
2014/1/8,Ford's Mulally quashes Microsoft rumors
2014/1/3,New vote at Boeing highlights split inside union
2013/12/19,Saab stock soars 30% on Brazil deal
2013/12/17,Stocks barely budge. Next up: The Fed!
2013/12/17,Stocks: Calm before the Fed storm?
2013/12/16,Dow jumps 130 points
2013/12/5,Ford: Mulally not leaving for Microsoft
2013/12/4,"Pentagon to cut jobs, contracts by $1 billion"
2013/12/4,Gogo flying high but turbulence ahead
2013/12/3,Big defense to Congress: End budget cuts
2013/11/20,"Big money dumps Boeing , buys Facebook"
2013/11/19,8 things to know about the 2013 bull market
2013/11/18,"Dow can't hold on to 16,000"
2013/11/18,Stocks edge toward new milestones
2013/11/14,Boeing may shift work from Seattle after union 'No' vote
2013/11/13,Boeing union vote would end traditional pension
2013/11/13,Surging U.K. economy surprises central bank
2013/10/28,Airbus calls for wider seats on long flights
2013/10/24,Mulally staying at Ford - for now
2013/10/23,Stocks slip as investors focus on earnings
2013/10/23,Stocks: Momentum fades with earnings eyed
2013/10/22,What shutdown? Lockheed Martin soars
2013/10/20,Stocks: Nothing holding the market back
2013/10/16,Cities with the biggest pay hikes
2013/10/7,Airbus signs first deal with Japan Airlines
2013/10/4,"Lockheed Martin to furlough 3,000 workers due to shutdown"
2013/10/4,Contractor stocks slammed by shutdown
2013/10/3,Shutdown could hurt Boeing deliveries
2013/10/1,Inside Alcoa's largest U.S. factory
2013/9/27,Ford's Mulally tops Microsoft wish list - report
2013/9/26,Companies shed more light on their political donations
2013/9/24,Airbus sees global fleet doubling by 2032
2013/9/19,Sweet dreams for Boeing investors
2013/9/5,Boeing to triple airplane deliveries to China
2013/8/30,Hawaiian Airlines to offer iPad minis inflight
2013/8/28,The sex scandal that derailed one of America's most promising executives
2013/8/12,Hyperloop: San Francisco to L.A. in 30 minutes
2013/8/1,Central banks in Europe keep rates on hold
2013/7/25,Durable goods: Why the latest economic number isn't as good as it sounds
2013/7/24,Stocks: Apple earnings lift spirits
2013/7/22,S&P 500 ekes out record close
2013/7/21,"Stocks: Apple, Facebook, McDonald's and Boeing on tap"
2013/7/18,Beacon blamed for Boeing Dreamliner fire
2013/7/18,"Dow, S&P 500 at record highs, up 19% in 2013"
2013/7/16,787 Dreamliner fire probe looks at Honeywell beacon
2013/7/15,Stocks gain as earnings come into focus
2013/7/12,Boeing's 787 problems return with Dreamliner fire in London
2013/7/12,"Stocks close at records, Boeing sinks"
2013/7/8,Asiana passengers likely to get millions
2013/7/8,Stocks: The gains continue
2013/7/8,Stocks: Investors buoyant to start the week
2013/7/8,Asiana Airlines shares tumble after San Francisco crash
2013/7/7,Boeing stock unscathed by this year's troubles
2013/7/1,Mark Carney: Best-paid central banker
2013/6/27,U.S. leads global arms exports surge
2013/6/25,States with sweetest corporate tax breaks
2013/6/19,10 most entrepreneurial states
2013/6/19,"Boeing CEO announces new, bigger 787"
2013/6/17,"Stocks bounce back, Fed uncertainty looms"
2013/6/17,Boeing's 787 nightmare is over
2013/6/17,Airbus A350 takes off for the first time
2013/6/13,5 fastest-growing states
2013/6/11,No more Super Tuesdays: Stocks close down 1%
2013/6/11,Stocks: Under renewed pressure
2013/5/17,Boeing is the new hedge fund favorite
2013/5/16,GE engines on Boeing 777 need fix
2013/5/9,Boeing speeds up pace of Dreamliner production
2013/5/2,Boeing's Dreamliner returns to the skies
2013/4/24,Boeing : Dreamliner grounding costs 'minimal'
2013/4/24,Looking past Boeing's Dreamliner issues
2013/4/24,Stocks end mostly lower
2013/4/24,Stocks: Earnings still pouring in
2013/4/21,"Stocks: Apple, Amazon, Netflix earnings on tap"
2013/4/20,"Boeing Dreamliner cleared to fix battery, start flying again"
2013/4/11,Bombardier's dogfight with Airbus & Boeing
2013/3/26,S&P 500 less than 2 points from record high
2013/3/26,Stocks: Keeping a watch on Europe
2013/3/26,Boeing completes first 787 Dreamliner test flight
2013/3/25,March Stock Mania: Google narrowly defeats Exxon
2013/3/15,Iron Maiden to launch its own beer
2013/3/13,Dow hits new all-time high. Again.
2013/3/13,Boeing flies high on 787 battery hopes
2013/3/13,Stocks: Retail sales in focus
2013/3/4,Boeing says it's ready to move fast on Dreamliner fix
2013/2/28,Boeing apologizes for Dreamliner fiasco
2013/2/27,Stocks: Investors step back
2013/2/20,Boeing's latest problem: Strike threat
2013/2/15,Dreamliner rival ditches controversial batteries
2013/2/11,Drones become big business
2013/2/8,Boeing warns airlines of Dreamliner delays
2013/2/5,Stocks: Earnings come to the fore
2013/2/5,Boeing wants to test 787 Dreamliner in flight
2013/1/31,Stocks: What goes up must come down?
2013/1/31,ANA: Dreamliner trouble costs reach $15 million
2013/1/30,"Stocks slip after Fed, but still near record highs"
2013/1/30,Boeing : Dreamliner woes won't hit earnings
2013/1/30,Stocks set weak open after GDP
2013/1/26,Boeing keeps building Dreamliners it can't fly
2013/1/24,United: Customers will 'flock' back to Dreamliner
2013/1/24,Airbus CEO says A350 on track
2013/1/18,Dreamliner: Where in the world its parts come from
2013/1/18,"Dow, S&P 500 close at 5-year highs"
2013/1/18,Turbulent times for Boeing and Airbus
2013/1/18,Stocks: Investors step back
2013/1/18,Hedge fund manager: Aerospace taking off
2013/1/17,The battery that grounded Boeing
2013/1/17,What you need to know about the Boeing Dreamliner
2013/1/17,Boeing overtakes Airbus as clouds gather
2013/1/17,Boeing's 787 airplane grounded worldwide
2013/1/17,Boeing's clout in Washington may face test
2013/1/17,Dow ends near 5-year high
2013/1/17,Stocks: Boeing and earnings in focus
2013/1/17,Boeing's Dreamliner fleet grounded
2013/1/16,Apple pops back above $500
2013/1/16,Stocks: Boeing drags on blue chips
2013/1/16,Dreamliner snafus have limited impact ... for now
2013/1/16,Stocks: It's earnings time
2013/1/16,More trouble for Boeing as Dreamliner forced to make emergency landing
2013/1/11,Stocks rise for 2nd week in a row
2013/1/11,FAA opens probe of Boeing Dreamliner woes
2013/1/11,Stocks: Earnings season rolls on
