Date,Title
2002/6/14,Woe is Wall Street
2002/6/12,Stock picks by the pros
2002/6/8,Invest in the sweet spot: 6 stocks
2002/6/5,"Lockheed, Loral mull tie"
2002/6/5,Plumtree IPO trades flat
2002/6/4,Plumtree raises $42.5M
2002/6/1,Veridian tops trio of IPOs
2002/5/23,Stock picks by the pros
2002/5/23,Nasdaq wires crossed
2002/5/23,Techs hold Nasdaq down
2002/5/11,Indigestion
2002/5/11,Stocks suffer losing week
2002/5/10,Tech tumble at midday
2002/5/10,Report questions Boeing accounting
2002/5/10,WorldCom woes plague Nasdaq
2002/5/7,A flounder market
2002/5/6,Stock concerns revisited
2002/5/3,Techs get soggy
2002/5/1,Lessons from the bear market
2002/4/30,Once again -- it's Andersen
2002/4/30,The slump continues
2002/4/30,Blue-chip losses build
2002/4/30,"Hot Stocks: Tyco, WorldCom"
2002/4/29,Stocks off to anxious start
2002/4/29,Slow start seen for stocks
2002/4/29,Stock rebound in doubt
2002/4/27,Lessons from the HP trial
2002/4/20,Blue chips hang in
2002/4/20,Microsoft: Still a growth stock?
2002/4/19,Boeing wins $4.5B fighter order
2002/4/19,Windows shopping
2002/4/19,Stocks recover losses
2002/4/18,Stock losses ease
2002/4/18,"IBM, Thanks for the Warning"
2002/4/18,Dow pulls back
2002/4/18,"Hot Stocks: Intel, Pfizer"
2002/4/17,Boeing misses 1Q mark
2002/4/17,Stocks ponder Greenspan
2002/4/17,Stocks may get Intel lift
2002/4/17,Taking stock in Greenspan
2002/4/17,Hearty rally on Wall St.
2002/4/11,A field day for the Dow
2002/4/4,Boeing 1Q deliveries fall
2002/4/3,Stocks with a fighting chance?
2002/4/3,Techs under pressure
2002/3/29,"Nasdaq: good day, tough quarter"
2002/3/28,Betting on the recovery
2002/3/28,Boeing joins Lockheed bid
2002/3/28,Dow resumes winning ways
2002/3/27,No blues for blue chips
2002/3/27,Stock picks by the pros
2002/3/23,Stocks step back
2002/3/22,Stock standstill
2002/3/21,Bears come out of hibernation
2002/3/19,Dow treads ahead of Fed
2002/3/16,"Funds: What's hot, what's not"
2002/3/15,Stocks go nowhere
2002/3/14,Putnam set to vote for HP-Compaq
2002/3/14,Airlines slow to recover
2002/3/13,HP-Compaq battle rages on
2002/3/13,"Hot Stocks: Microsoft, IBM"
2002/3/12,HP says big investors favor Compaq deal
2002/3/12,Dow industrials keep rising
2002/3/9,Economic data boost stocks
2002/3/8,Bulls on the bench
2002/3/8,Hot Stocks: Best Buy
2002/3/7,"ECB, BoE keep rates on hold"
2002/3/7,South Africa to buy Airbus planes
2002/3/7,Stocks to watch Thursday
2002/3/7,Blue-chip bonanza
2002/3/6,Dow breaks winning streak
2002/3/6,Hot Stocks: Intel
2002/3/5,European markets end lower
2002/3/5,"BA , KLM passengers return"
2002/3/5,Northrop goes hostile
2002/3/1,"ECB, BoE seen holding rates"
2002/3/1,French confidence falters
2002/2/28,Cisco hampers Nasdaq
2002/2/27,Defense IPO rises 22%
2002/2/26,Northrop looks for buyers of TRW unit
2002/2/23,Revenge of the war IPOs
2002/2/22,Techs drag markets lower
2002/2/22,Techs spook Wall St.
2002/2/21,Boeing cuts satellite jobs
2002/2/20,Hot Stocks: Circuit City
2002/2/19,"Southwest to hire 4,000"
2002/2/19,BoE chief cautious on rates
2002/2/18,Greece to cut jobs at Olympic
2002/2/18,EC benefits plan draws fire
2002/2/15,Scent of a sell-off?
2002/2/14,European markets end higher
2002/2/13,UK unemployment eases
2002/2/13,"BA to shed another 5,800 jobs"
2002/2/12,Continental defers jet delivery
2002/2/7,"BoE , ECB hold on rates"
2002/2/7,Anadarko warns on 1Q
2002/2/5,Ryanair defies terror slump
2002/2/4,Boeing's challenges
2002/2/4,British Airways posts loss
2002/1/28,How we arrived at this year's rankings
2002/1/28,European markets end higher
2002/1/28,KLM soars on BA hopes
2002/1/26,"AMR, BA drop alliance plans"
2002/1/25,How we arrived at this year's rankings
2002/1/25,Rocket relief
2002/1/25,UK economic growth slows
2002/1/24,Boeing gets $9.7B order
2002/1/24,Martha on the make?
2002/1/24,Techs take the lead
2002/1/23,AOL-Microsoft case no surprise
2002/1/23,Lower Boeing profit in line
2002/1/23,Wall St. tries to connect
2002/1/23,Ryanair to order Boeing 737s
2002/1/19,Boeing's unusual beginnings
2002/1/19,Nasdaq erases 2002 gain
2002/1/18,Lufthansa traffic slows
2002/1/18,Delta grounds jet orders
2002/1/17,UK retail sales decline
2002/1/17,Airbus jet sales soar
2002/1/17,Intel promotes Otellini
2002/1/16,Losses fill skies in 4Q
2002/1/16,UK unemployment rises
2002/1/14,U.S. loses tax row with EU
2002/1/14,Raytheon sells unit to L-3
2002/1/14,Jet Blue to buy Airbus A320s
2002/1/12,Dow declines 5 out of 5
2002/1/11,Missile defense team named
2002/1/11,Continental Air to take $39M charge
2002/1/10,BMI to fly budget carrier
2002/1/10,BoE keeps rate on hold
2002/1/9,Orders fell 45%: Boeing
2002/1/9,BoE to keep rates on hold
2002/1/8,UK consumers keep spending
2002/1/7,Europe ends lower
2002/1/7,KLM expects Mideast BA deal
2002/1/7,Easyjet to buy 75 aircraft
2002/1/5,Wall St.'s happy new year
2002/1/5,Hot Stocks: Toys 'R' Us
2002/1/4,European markets higher
2002/1/4,"BA , KLM traffic falls"
2002/1/4,BOE chief eyes rate rise
2002/1/4,Stocks to watch Friday
2002/1/1,Wall St. ends tough year
2001/12/29,Keep the profits coming
2001/12/27,FCC OKs Boeing Net service
2001/12/27,Five tech stocks for 2002
2001/12/22,Cable's fuzzy picture
2001/12/19,Turbulence in the air
2001/12/19,Boeing in tanker pact
2001/12/19,Brazil rebounds on U.S. lead
2001/12/18,Boeing debt rating cut
2001/12/18,Justice opposes AA-BA pact
2001/12/18,Airbus cutting 500 jobs
2001/12/17,Wall St. looks past deals
2001/12/14,U.S. stocks sell off
2001/12/13,Holiday job cuts mount
2001/12/13,"Boeing keeps 717, cuts jobs"
2001/12/13,Teen angels
2001/12/11,Europe a mixed bag
2001/12/10,Europe closes lower
2001/12/7,EasyJet traffic soars
2001/12/6,Europe eases slightly
2001/12/6,Airbus gets $3.6B order
2001/12/5,BoE leaves rates on hold
2001/12/3,"ECB, BoE to hold rates"
2001/11/27,"BAE Systems sheds jets, jobs"
2001/11/26,Boeing cuts jobs
2001/11/17,UAL cuts fleet replacement
2001/11/17,Boeing in the bargain bin
2001/11/14,Stocks to watch Wednesday
2001/11/13,Airlines on the rebound
2001/11/13,Hanging tough
2001/11/12,Airbus A300 built in 1988
2001/11/7,European bourses down
2001/11/6,Europe stocks cut back
2001/11/6,BA posts falling profits
2001/11/5,"Goodrich, Eaton win contracts"
2001/11/5,Wall St. preliminaries
2001/11/5,Airbus edges Boeing
2001/11/2,Wall St. shrugs off data
2001/11/2,Boeing accelerates layoffs
2001/11/1,Lockheed looking to Boeing
2001/11/1,"Boeing , El Al eye deal"
2001/11/1,KLM expects 'significant' loss
2001/10/31,Continental posts 3Q loss
2001/10/31,Boeing mulls plant shutdown
2001/10/30,Better than bad?
2001/10/30,Selloff on Wall Street
2001/10/30,Wall St. retreats
2001/10/30,Hot Stocks: Counter-terrorism
2001/10/30,Defense industry boost
2001/10/29,Stock picks by the pros
2001/10/29,Wall St.'s rally threatened
2001/10/28,Will Wall St. keep rolling?
2001/10/27,Parts for planes
2001/10/27,Lockheed awarded contract
2001/10/27,Hot stocks: Boeing
2001/10/27,Wall St. basks in gains
2001/10/26,Lockheed tops 3Q targets
2001/10/24,Stock picks by the pros
2001/10/23,European stocks gain ground
2001/10/23,Midwest Express buys 20 Boeing 717s
2001/10/20,Defense: Stock by stock
2001/10/20,Playing defense
2001/10/19,Europe ends lower
2001/10/19,"Rolls-Royce to shed 5,000 jobs"
2001/10/19,"Latin American, Canadian stocks fall"
2001/10/19,Worries weigh on stocks
2001/10/18,Stock picks by the pros
2001/10/18,Southwest lands a profit
2001/10/18,Boeing warns on sales
2001/10/18,Earnings blanket Wall St.
2001/10/17,Boeing to slash output
2001/10/17,Airbus improves doors
2001/10/14,"Terrorism, profits in fore"
2001/10/13,Talk About Ups and Downs
2001/10/13,"Terrorism, profits in fore"
2001/10/9,European stocks end flat
2001/10/4,UK's BoE cuts interest rate
2001/10/4,Wall St. bulls on parade
2001/10/3,European airlines in crisis
2001/10/3,BA rocked by U.S. attacks
2001/10/3,BoE may cut interest rate
2001/10/3,SEC targets 38 stocks
2001/10/3,AMR secures cockpit door
2001/10/3,Hot Stocks: Compaq drops
2001/10/3,Wall St. stands its ground
2001/10/2,Boeing inks China deal
2001/10/2,Stocks to watch Tuesday
2001/10/2,Stocks back off of lows
2001/10/2,Boeing to ink China deal
2001/9/28,BA bosses take pay cuts
2001/9/27,Boeing evacuates
2001/9/26,Boeing gets 20-jet order
2001/9/26,Hot Stocks: Exodus falls
2001/9/26,Tentative gains on Wall St.
2001/9/25,Boeing CEO sees profits
2001/9/25,"Alitalia to shed 2,500 jobs"
2001/9/25,U.S. stocks strike back
2001/9/22,Economy down in the air
2001/9/22,Brutal week on Wall St.
2001/9/22,Boeing settles lawsuit
2001/9/21,Stock picks by the pros
2001/9/21,Sales forecasts lowered
2001/9/21,Boeing helping airlines
2001/9/21,Hot Stocks: Boeing bows
2001/9/21,Wall St. whacked again
2001/9/20,Economy down in the air
2001/9/20,Retail sales to suffer
2001/9/20,European stocks plunge
2001/9/20,Airlines hit by U.S. attack
2001/9/20,Recovery put on hold
2001/9/20,EADS stands by targets
2001/9/20,British Airways to axe jobs
2001/9/20,"BA to cut 5,200 jobs"
2001/9/20,"AMR, United each cut 20,000"
2001/9/20,U.S. stocks attempt rebound
2001/9/20,Boeing shares recover
2001/9/19,Air execs see bankruptcies
2001/9/19,European bourses decline
2001/9/19,Mixed morning on Wall St.
2001/9/19,Wall St. looks forward
2001/9/19,"Boeing to shed 30,000 jobs"
2001/9/19,Hot Stocks: FedEx drops
2001/9/18,UK cuts key interest rate
2001/9/18,Sectors: Security on rise
2001/9/18,Stocks fall to 3-year lows
2001/9/17,Europe closes higher
2001/9/15,Stocks could get hit
2001/9/15,Some sectors at risk
2001/9/15,Wastler: China's choice
2001/9/13,Wall St. looks to the open
2001/9/13,European bourses end higher
2001/9/13,WTC firms pick up pieces
2001/9/12,Investors: Sit tight
2001/9/12,"Attacks shake U.S., world"
2001/9/11,Investors worried after attack
2001/9/11,Trade Center hit by planes
2001/9/11,Hot Stocks: Chiming in
2001/9/8,Hot Stocks: BEA beats
2001/9/8,Jobs report shocks stocks
2001/9/7,GE's Welch retires
2001/9/7,AMR warns of wider loss
2001/9/6,Favorite Stock: MSC
2001/9/6,Techs sink European markets
2001/8/31,Are labor unions dead?
2001/8/25,Wall St. bulls on parade
2001/8/24,Skies safe from layoffs
2001/8/21,Airbus in China talks
2001/8/21,American grounds old jets
2001/8/16,Price-fixing probe deepens
2001/8/15,BoE voted 6-3 to cut rate
2001/8/13,Emery grounds jets
2001/8/11,CEOs urge Bush on taxes
2001/8/10,US Airways sees 3Q loss
2001/8/10,Toyota in minority plan
2001/8/9,EADS boosts revenues
2001/8/8,Boeing set for $2B order
2001/8/8,Airlines: Gloomy outlook
2001/8/6,BA operating profit halves
2001/8/3,"BA , AMR set new alliance"
2001/8/2,BoE's surprise rate cut
2001/8/1,"ECB, BoE set to hold rates"
2001/7/31,Boeing to shift workers
2001/7/26,Autonomy profit halves
2001/7/19,"Nasdaq tumbles, Dow dips"
2001/7/19,Hot Stocks: Tepid techs
2001/7/18,Stock picks by the pros
2001/7/18,Boeing 2Q tops estimate
2001/7/18,Wall St. studies Intel
2001/7/17,Boeing inks 9-plane pact
2001/7/16,EU may probe Sabena aid
2001/7/15,Here come the earnings
2001/7/12,Stocks make modest gains
2001/7/11,Stocks sink to 12-week lows
2001/7/10,U.S. stocks bounce back
2001/7/4,European techs tumble
2001/7/4,KLM warns on profit
2001/6/30,Strong quarter on Wall St.
2001/6/25,Ryanair profit soars
2001/6/22,GE sets $1B jet program
2001/6/22,Nasdaq rises for 3rd day
2001/6/21,401(k) payments reduced
2001/6/20,Jet sales seen at $1.7T
2001/6/20,Nasdaq rises - barely
2001/6/19,Airbus wins massive order
2001/6/19,Nasdaq higher; Dow flat
2001/6/19,News from Latin America
2001/6/18,EU slams GE-deal critics
2001/6/18,GE-Honeywell up in air
2001/6/15,GE-Honeywell deal kaput?
2001/6/15,US stocks plunge on news
2001/6/13,Fliers to get Net link
2001/6/13,Lufthansa cuts forecast
2001/6/13,Wall St. recoups losses
2001/6/12,Europe closes down
2001/6/11,Stock picks by the pros
2001/6/11,"BA , American set for talks"
2001/6/11,Boeing pushes Net strategy
2001/6/10,"KLM, BA deny merger talks"
2001/6/9,Welch-EU meeting delayed
2001/6/9,Wall St. ends lower
2001/6/7,Boeing probes sabotage
2001/6/7,"BA , American talk venture"
2001/6/6,BoE holds rate at 5.25%
2001/6/6,Nasdaq jumps 3.6 percent
2001/6/6,Hot Stocks: Burnt Pizza
2001/6/5,America West slims down
2001/6/5,Boeing gets $4B contract
2001/6/2,Wall St. rally led by data
2001/5/31,"Boeing , union reach pact"
2001/5/29,"Boeing , Russia in talks"
2001/5/28,Alcatel-Lucent seen near
2001/5/28,"Alcatel, Lucent deal close"
2001/5/26,Wall St. pulls back
2001/5/25,Deal falls to BAE/Saab
2001/5/24,"Boeing , union extend talks"
2001/5/24,Nasdaq halts winning ways
2001/5/24,Hot Stocks: Jumpin' Gene
2001/5/23,Europe down at close
2001/5/23,Boeing in tanker talks
2001/5/22,British Airways takes off
2001/5/21,Boeing union sets strike
2001/5/21,Airbus invades Japan
2001/5/18,Steady gains on Wall St.
2001/5/17,Lufthansa profit dives
2001/5/15,Boeing China deal on hold?
2001/5/11,Freight slowdown drags on
2001/5/10,Boeing chooses Chicago
2001/5/10,Stock picks by the pros
2001/5/10,Boeing flies to Chicago
2001/5/10,Hot Stocks: Smooth landing
2001/5/9,Boeing considers Chicago
2001/5/8,Modest slump for U.S. techs
2001/5/8,Hot Stocks: Power surge
2001/5/7,CFO move hits Lucent
2001/5/7,Wall St.'s task at hand
2001/5/7,Lucent ousts Hopkins as CFO
2001/5/6,"EU to block GE, honeywell"
2001/5/4,Tech retreat trips Wall St.
2001/5/2,Stock picks by the pros
2001/5/2,Machinists sue Boeing
2001/5/2,Dow rallies to 10-week high
2001/5/1,Boeing schedules new jet
2001/4/30,AngloGold profit rises
2001/4/30,UK profit warnings surge
2001/4/30,Your next vacation in space
2001/4/28,Your next vacation in space
2001/4/27,Euro rival for Raytheon
2001/4/24,Dassault margins fall
2001/4/23,"Delta, pilots reach deal"
2001/4/21,Hot stocks: Taking a lick
2001/4/21,Stocks drift on Wall St.
2001/4/20,Boeing 1Q profits soar
2001/4/20,Latest earnings news
2001/4/20,Wall St. may say 'Whoa'
2001/4/13,Boeing to revamp 747
2001/4/11,"Dow rises above 10,000"
2001/4/10,Modest gain on Wall St.
2001/4/9,10 tech stocks to own
2001/4/7,Steady selloff on Wall St.
2001/4/6,Southwest CEO cautious
2001/4/6,Big gains on Wall St.
2001/3/30,Boeing jet draws interest
2001/3/30,Wall St. 1Q finally ending
2001/3/30,Boeing drops super-jumbo
2001/3/28,Iridium emerges from ashes
2001/3/23,Boeing moves some work
2001/3/22,Boeing to fly from Seattle
2001/3/18,Wall St. tunes into the Fed
2001/3/17,Wall St. takes a beating
2001/3/8,UK leave rates on hold
2001/3/6,Lockheed eyeing FAA deal
2001/3/6,Europe posts solid gain
2001/3/6,Wall St. plows ahead
2001/3/5,KLM may make Go bid
2001/3/3,Dow industrials turn higher
2001/3/3,Boeing plant still 80% up
2001/3/2,Wall St. sidesteps loss
2001/3/1,Stock picks by the pros
2001/3/1,Seattle begins recovery
2001/3/1,Techs drag Europe down
2001/3/1,BAE military orders slow
2001/3/1,Quake shakes businesses
2001/2/16,Defense stocks
2001/2/16,Qantas in $1.2B deal
2001/2/15,Wall St. reboots
2001/2/12,Stock picks by the pros
2001/2/8,BoE cuts rate to 5.75%
2001/2/7,UK set to cut rates
2001/2/6,Ryanair earnings soar
2001/2/5,BA jets back into profit
2001/2/2,Hot Stocks: Shaky Sycamore
2001/1/30,Mounting layoffs
2001/1/29,A plague of job cuts
2001/1/29,Airbus sells $17.2B planes
2001/1/26,"Condit: 8,000 jobs may go"
2001/1/26,Boeing to close plant?
2001/1/26,Worry over CEO's death
2001/1/25,Atlas Air CEO dies in crash
2001/1/24,BoE close to rate cut
2001/1/19,Boeing considers faster jet
2001/1/18,Latest earnings news
2001/1/18,"Nasdaq rises, Dow falls"
2001/1/17,GM 4Q beats forecasts
2001/1/17,Stock picks by the pros
2001/1/17,Boeing flies over 4Q target
2001/1/17,Wall St. chipper on Intel
2001/1/17,Northwest to buy planes
2001/1/14,Here come the earnings
2001/1/11,BA 'toils' to offload Go
2001/1/11,Atlas in superjumbo talks
2001/1/10,Europe swings lower
2001/1/10,End of the TWA era
2001/1/10,BAE dives after warning
2001/1/10,BoE set to hold rates
2001/1/9,UPS doubles plane order
2001/1/8,Airbus to form new firm
2001/1/5,"Europe mixed, insurers off"
2001/1/5,FedEx 'nears jumbo order'
2001/1/4,Chinese herbs recalled
2001/1/4,Street Talk: Fed boost
2001/1/3,Bush to meet with CEOs
2001/1/3,Aircraft safety probe at GE
2001/1/2,Boeing meets order target
2000/12/30,Wall St. ends a tough year
2000/12/29,Telecoms buoy Europe
2000/12/29,Boeing in Japan jet talks
2000/12/22,Northrop in $3.8B buy
2000/12/20,Europe falls on Nasdaq hit
2000/12/20,BoE hints at rate cut
2000/12/19,Europe spurts higher
2000/12/19,Airbus jumbo on runway
2000/12/19,Wall St. waits for Fed
2000/12/15,Virgin buys $3.8B jumbos
2000/12/15,Working Your Degree
2000/12/13,Boeing taps new executive
2000/12/13,"Europe mixed, techs fall"
2000/12/13,BA cooks up venture
2000/12/12,End of road for Oldsmobile
2000/12/12,"Europe mixed, techs fall"
2000/12/12,Boeing sets buyback plan
2000/12/8,Working Your Degree
2000/12/7,Virgin Atlantic to recruit
2000/12/7,U.K. rates unchanged
2000/12/7,Iridium satellites rescued?
2000/12/6,British Air cuts more jobs
2000/12/5,"Oh, you shouldn't have!'"
2000/12/5,A $1M fine for Alaska Air?
2000/11/30,Nasdaq hits 13-month low
2000/11/29,Analyst: GM mulls deal
2000/11/29,Qantas splits jet order
2000/11/29,Qantas in jumbo buy
2000/11/28,Street Talk: Gap stop
2000/11/28,Dow rallies again
2000/11/27,Boeing gets $1.6B order
2000/11/27,In Focus: GE
2000/11/21,Janus still likes growth
2000/11/20,Wall St. sows its oats
2000/11/20,Boeing spinoffs in view?
2000/11/17,Semis plunge Nasdaq 4%
2000/11/16,Master procurement details
2000/11/15,Qantas set for Airbus buy?
2000/11/15,U.S. biz eyes Vietnam
2000/11/15,easyJet soars in debut
2000/11/14,Pro Air to fly again?
2000/11/8,Europe ends mostly lower
2000/11/6,Hess swoops on Lasmo
2000/11/6,Street Talk: Sprint to PCS
2000/11/6,British Air 2Q profit flies
2000/11/3,Working Your Degree
2000/11/3,"UPS, Boeing in $2B deal"
2000/11/3,Stocks to watch Friday
2000/11/2,Europe ends mixed
2000/11/1,Delta offers wage hike
2000/10/31,EasyJet sets IPO pricing
2000/10/31,FAA audit clears Boeing
2000/10/26,United pilots approve pact
2000/10/25,EADS says profit 'on track'
2000/10/23,Lucent names new CEO
2000/10/23,Europe up on telecoms
2000/10/20,Stock picks by the pros
2000/10/19,Latest earnings roundup
2000/10/18,Boeing beats estimates
2000/10/18,Revenue worries Wall St.
2000/10/18,Net2Wireless
2000/10/17,Chevron in for rough ride
2000/10/17,Nasdaq falls; Dow rises
2000/10/16,UK airline upstart to float
2000/10/16,Dow industrials pull ahead
2000/10/13,Wall St. wary of Mideast
2000/10/13,"Boeing , UPS deal to fly?"
2000/10/12,Vote won't gore defense
2000/10/9,BA overhauls Europe arm
2000/10/6,"Street Talk: AT&T, GM hit"
2000/10/5,Boeing gets $1.2B order
2000/10/5,ECB airs surprise rate hike
2000/10/5,BoE holds rates steady
2000/10/5,Semis send Nasdaq higher
2000/10/4,Nasdaq loses 100 points
2000/10/3,Old economy' boosts Dow
2000/10/3,Biotechs slam Nasdaq
2000/10/2,Street Talk: Highlight lists
2000/9/30,Trade sanctions delayed
2000/9/30,Airbus wins $8.6B jet pact
2000/9/29,Hot Stocks: IPO relief
2000/9/29,Apple may bite Wall St.
2000/9/27,Europe edges higher
2000/9/27,Wall St. looks to 3Com
2000/9/27,U.S. OKs Boeing-Hughes
2000/9/25,Street Talk: Nortel swings
2000/9/22,"British Air, KLM nix talks"
2000/9/22,Stock picks by the pros
2000/9/21,Dow takes 100-point dive
2000/9/20,Boeing ups cash estimate
2000/9/18,American joins GetThere
2000/9/18,Smiths scoops up TI Group
2000/9/15,Europe in a tech slump
2000/9/14,BAE pretax profit up 34%
2000/9/13,Bank Austria deal okayed
2000/9/12,FBI eyes TRW-fraud claim
2000/9/12,BA and KLM alliances
2000/9/11,Europe slides on telecoms
2000/9/11,British Air explores skies
2000/9/5,Bonds hold steady
2000/9/1,BA looks closer at Air India
2000/9/1,"Ford face charges, adds new tire supplier"
2000/9/1,"Firestone, Ford face charges, labor pains"
2000/8/30,Ford knew of faulty tires
2000/8/25,Paris leads Europe charge
2000/8/25,Wall St. on win streak
2000/8/24,Rolls rocked after warning
2000/8/24,Design flaw cited in '96 crash
2000/8/22,Fed in focus as stocks gain
2000/8/21,Jet inspections advanced
2000/8/21,UAL to discipline workers
2000/8/18,Boeing plans consolidation
2000/8/18,"Boeing to reassign 3,500"
2000/8/18,Avistar falls 22% in debut
2000/8/17,UAL warns on 3Q profit
2000/8/16,"UK wages, joblessness fall"
2000/8/16,Hot stocks: Hooray BEA
2000/8/15,BA grounds Concordes
2000/8/15,Boeing buys flight-data firm
2000/8/11,FAA finds Boeing flaws?
2000/8/9,Cathay flies over forecast
2000/8/9,Ryanair 1Q profit climbs
2000/8/8,Boeing settles lawsuits
2000/8/7,BA meets 1Q estimates
2000/8/4,Southwest fires pilots
2000/8/3,Boeing settles 'copter suits
2000/8/3,Boeing may faces fines
2000/7/26,Europe ends mostly lower
2000/7/25,Airbus closes more deals
2000/7/24,Boeing airs 120 orders
2000/7/24,Airbus unveils A3XX order
2000/7/21,Stock picks by the pros
2000/7/20,Nasdaq is down for 2000
2000/7/20,Stock picks by the pros
2000/7/19,Boeing soars by estimates
2000/7/19,Latest earnings news
2000/7/19,BoE unanimous on rates
2000/7/19,Earnings flood Wall St.
2000/7/18,Stock picks by the pros
2000/7/18,India speeds jet purchase
2000/7/13,"BA , KLM to submit tie to EU"
2000/7/12,"Report: BA , KLM to merge"
2000/7/12,"British Air, KLM to merge?"
2000/7/10,European stocks turn sour
2000/7/10,EADS slips after IPO
2000/7/10,BAE targets Saudi sales?
2000/7/9,EADS IPO prices low
2000/7/7,EADS seen pricing IPO low
2000/7/7,Boeing to launch new jet
2000/7/6,UK rates unchanged
2000/7/6,Europe ends a mixed bag
2000/7/5,Boeing may seal $5.5B deal
2000/7/5,Nasdaq hit by warnings
2000/7/5,Wall St. pumped up for oil
2000/7/4,High hopes for EADS' IPO
2000/6/29,Southwest selects Boeing
2000/6/28,Wall St. ready to rate Fed
2000/6/28,Europe blocks Sprint deal
2000/6/27,Stocks to watch Tuesday
2000/6/27,Wall St.'s rate wait starts
2000/6/27,Boeing cuts SoCal jobs
2000/6/26,Stocks to watch Tuesday
2000/6/26,Asia clings to gains
2000/6/26,Give it the old college try
2000/6/25,Nomura mulls BAE bid?
2000/6/23,Airbus OKs restructuring
2000/6/23,Morris bullish on Boeing
2000/6/23,Talking Stocks of the week
2000/6/23,Paris up as London falters
2000/6/23,Jet contract up for grabs
2000/6/22,Four airlines in alliance
2000/6/20,Wall St. gauges oil prices
2000/6/16,Fuel costs hit Virgin profit
2000/6/15,Boeing gains $8.9B contract
2000/6/15,Stocks to watch Friday
2000/6/15,"BAE to slash 3,800 jobs"
2000/6/13,PAL back in the black
2000/6/12,Northrop sells jet parts unit
2000/6/9,Crossing the great jet divide
2000/6/9,Talking Stocks of the week
2000/6/9,EADS IPO worth $3.3B?
2000/6/9,Airlines: a three-horse race
2000/6/7,Europe falls for third day
2000/6/7,British Air in KLM talks
2000/6/7,Wednesday's hot stocks
2000/6/6,"Techs, drugs drag Europe"
2000/6/5,Airbus notches A3XX order
2000/6/5,Glickenhaus talks stocks
2000/6/5,"British Air, KLM in talks?"
2000/6/2,BA drops Olympic bid
2000/5/26,"Boeing , Hughes deal eyed"
2000/5/26,Friday before-hours trade
2000/5/26,Wall St. on Microsoft watch
2000/5/26,Stock picks by the pros
2000/5/26,"Durables fall, incomes rise"
2000/5/25,Wall St. eyes economy
2000/5/25,Dow hit by financials
2000/5/24,More want superjumbo jet
2000/5/23,British Airways loss grows
2000/5/22,Chinese shopping spree
2000/5/22,U.S. sees China bonanza
2000/5/19,Airbus stalls on jumbo
2000/5/19,FAA orders safety checks
2000/5/19,Techs may bug Wall St.
2000/5/19,Trade deficit hits record
2000/5/11,Airbus wins 50-jet order
2000/5/11,Airlines get in Net formation
2000/5/10,Europe weighed by techs
2000/5/9,Lockheed wins F-16 deal
2000/5/8,Boeing names new CFO
2000/5/8,Waiting for stock rebound
2000/5/4,Wall Street patiently dithers
2000/5/4,U.K. holds rate at 6%
2000/5/3,Factory orders roll ahead
2000/5/2,Hotel rivals join B2B fray
2000/5/2,KLM: life after Alitalia
2000/5/1,Emirates buys super-jumbo
2000/5/1,Venture funds still at it
2000/4/28,BMW loses Rover buyer
2000/4/27,BAE buys Lockheed unit
2000/4/27,Boeing to add Net to flights
2000/4/26,Fighter work may be split
2000/4/26,Durable orders surge
2000/4/25,Europe posts firm gains
2000/4/25,British Air names new CEO
2000/4/24,Boeing CFO flies to Lucent
2000/4/24,Microsoft is Wall St. focus
2000/4/24,MSFT weighs on techs
2000/4/24,Monday's after-hours trade
2000/4/21,Emirates eyes new jumbo
2000/4/20,"Dasa to cut 1,200 jobs"
2000/4/19,Boeing flies over forecast
2000/4/19,Wall St. fights to keep rally
2000/4/19,Stocks to watch Thursday
2000/4/19,U.S. trade deficit widens
2000/4/19,Latest earnings news
2000/4/17,Talking Stocks: Melcher
2000/4/14,EADS signs Finmeccanica
2000/4/10,"Boeing , BAE in talks?"
2000/4/10,Lockheed workers strike
2000/4/7,U.S. job growth jumps
2000/4/7,Jobs report cheers Wall St.
2000/4/6,Lockheed's China trouble
2000/4/5,UK seen holding rates
2000/3/31,Stock picks by the pros
2000/3/29,Stock picks by the pros
2000/3/28,Aerospace B2B takes off
2000/3/28,Japan may join jet deal
2000/3/28,Wall St. awaits decisions
2000/3/24,Aerospace auctions?
2000/3/23,Asian markets end mixed
2000/3/23,News Corp. eyes Hughes
2000/3/21,Boeing expects recovery
2000/3/20,Fed holds Wall St. attention
2000/3/20,Brown to budget cautiously
2000/3/17,"Boeing , union reach pact"
2000/3/17,CPI hangs over Dow party
2000/3/17,Friday's hot stocks
2000/3/17,Nasdaq regains spotlight
2000/3/17,Dow fund has a good week
2000/3/15,BMW to abandon Rover?
2000/3/10,British Airways CEO quits
2000/3/8,Strike to hit Boeing 1Q
2000/3/8,Arospatiale profit drops
2000/3/3,BAE targets U.S. buys
2000/3/3,Europe ends in record mood
2000/3/2,Wall St. gets Palm reading
2000/2/29,Boeing extends 777 range
2000/2/29,Welch talks Net strategy
2000/2/28,Wall St. eyes economy
2000/2/28,Solid profit ignites Daimler
2000/2/25,Undiscovered funds - a find
2000/2/23,Wall St. eyes Greenspan
2000/2/20,"Short week and Mr. G, Part 2"
2000/2/16,"Value stocks, sexy again?"
2000/2/15,Boeing may resume delivery
2000/2/15,Dow stocks face bad news
2000/2/11,Wall St. mulls retail drop
2000/2/10,Wall St. eyes tech shares
2000/2/9,Engineers strike Boeing
2000/2/9,Wall St. watches Web
2000/2/9,U.S. stocks slide
2000/2/9,U.S. stocks lose ground
