Date,Title
2013/1/10,ECB holds rates as signs of stability emerge
2013/1/9,Stocks bolstered by earnings
2013/1/9,More problems for Boeing's Dreamliner
2013/1/8,Dreamliner's first flight
2013/1/8,Boeing shares fall on 787 Dreamliner problems
2012/12/9,Even FCC thinks in-flight gadget bans are dumb
2012/11/29,British banks may need more capital
2012/11/26,SGB's jatropha vision: Jet fuel grown from seeds
2012/11/21,Fiscal cliff helps mend Obama-CEO relations
2012/11/14,U.K. growth slowing as Europe weakens
2012/11/8,Business to Obama: Let's work together -- our way
2012/11/6,Stocks close higher on Election Day
2012/11/1,Mulally staying as Ford CEO into 2014
2012/10/24,Investors sidelined by cloud of uncertainty
2012/10/24,Stocks: Investors take a breather
2012/10/23,Earnings stink like a big pile of trash
2012/10/22,Stocks to open higher
2012/10/10,"BAE, EADS drop $45 billion merger plan"
2012/10/8,BAE's biggest shareholder slams EADS merger
2012/9/26,Top CEOs: fiscal cliff is hurting jobs
2012/9/25,9 hot businesses you can start now
2012/9/20,Best stocks to own if you're betting on Romney
2012/8/9,Fiscal cliff threatens small businesses
2012/7/25,Stocks end in mixed territory
2012/7/25,"Stocks: Apple drags tech, Caterpillar boosts Dow"
2012/7/12,Airlines: 1M jobs in next 20 years
2012/7/12,Boeing wins $14.7 billion jet order from United
2012/7/12,"Stocks falter on global growth fears, earnings"
2012/7/11,Boeing : New 737 will be delivered on-time
2012/7/5,ECB cuts rates to all-time low
2012/7/4,"ECB rate cut expected, but that's about it"
2012/7/3,Federal government misses small business contract goal - again
2012/7/2,Airbus plans new factory in Alabama
2012/6/15,Bank of England moves to boost British economy
2012/6/11,Ignore the debt hype. College is a great investment
2012/6/8,"Homes inspired by planes, trains and automobiles"
2012/6/8,7 most business-friendly cities
2012/6/8,An airplane to call home
2012/6/4,10 most entrepreneurial states
2012/6/1,Airlines seek to slash fuel costs
2012/5/23,Checking accounts with the biggest payoffs
2012/5/21,Stocks rebound on Europe hopes
2012/5/7,Manufacturers to banks: We need money now
2012/4/26,Stocks gain as 'stimulus addicts' look for a fix
2012/4/26,Stocks: Choppy trading ahead
2012/4/25,"Bernanke boosts stocks, Apple rallies"
2012/4/25,"U.S. stocks: Apple, other earnings to provide lift"
2012/4/22,"Stocks: Earnings, economy and Europe back in focus"
2012/4/16,Emerging markets power Boeing's growth
2012/4/16,U.S. companies betting big in China
2012/4/11,Alabama's sweet manufacturing boom
2012/4/5,"Jamie Dimon: Lobbying is good, Washington is bad"
2012/3/30,Ford's Mulally earns $29.5 million
2012/3/22,"China hits rough patch, but landing looks soft"
2012/3/12,U.S. and EU claim victory in Boeing subsidy case
2012/3/7,CEOs: Create jobs by cutting corporate tax rate and regulations
2012/3/6,"Obama, CEOs to talk about jobs"
2012/2/28,Orders for durable goods plunge most in 3 years
2012/2/17,White House predicts 2 million more jobs in 2012
2012/2/8,"No euro freeze, just squeeze"
2012/2/2,Stock picks from Fed officials
2012/1/25,Stocks jump after Fed's low-rate pledge
2012/1/25,Stocks set for quiet open
2012/1/20,2012: South Carolina's rebound year
2012/1/11,Mighty winds force trans-Atlantic fuel stops
2012/1/4,Boeing to close Kansas plant
2011/12/23,NLRB could be shut down in new year
2011/12/9,Boeing unfair labor charge dropped
2011/12/7,My biggest tax nightmare!
2011/12/7,Seniors mind their business
2011/12/5,Time to '+1' Google stock?
2011/11/30,Boeing keeps new jet at Pacific Northwest plants
2011/11/29,American Airlines files for bankruptcy
2011/11/22,Cool companies
2011/11/17,Boeing sets record with $22 billion order
2011/11/14,Boeing ascends on Emirates deal
2011/11/14,Stocks slide as eurozone issues persist
2011/11/14,Boeing's $18 billion deal is biggest ever
2011/11/14,"Stocks: New leaders, new week"
2011/11/7,United enters the biofuel age
2011/11/4,Bizarre hotels: Sleep in a coffin or cliff-top yurt
2011/10/26,Worth the wait: Boeing 787 a hit with first passengers
2011/10/26,Stocks end higher on Europe hopes
2011/10/26,Stocks: Waiting for Europe's grand plan
2011/10/25,Boeing's game changer finishes first flight
2011/10/25,Preparing for Dreamliner's first flight
2011/10/3,American Air stock loses 32% on bankruptcy fear
2011/9/29,Dozens of Boeing workers charged in drug bust
2011/9/26,Stocks surge on hopes for Europe
2011/8/24,"Rise in durable goods orders is a ""relief"""
2011/8/22,Should HP (aka IBM Lite) be kicked out of Dow?
2011/8/17,Striking Verizon workers to lose medical benefits
2011/8/12,"Verizon claims sabotage, calls cops on strikers"
2011/8/12,Stashing cash in tampon boxes - and other sneaky spots
2011/8/9,Dow soars 400 points in wild session
2011/8/2,"Stocks plunge, S&P goes negative for year"
2011/7/27,Dow slides on debt fears
2011/7/27,Stocks flat ahead of open
2011/7/25,Stocks close lower as investors await debt deal
2011/7/24,Stocks: Big week ahead
2011/7/20,American Airlines' spending spree
2011/7/20,Stocks: Investors sidelined by debt debate
2011/7/20,American in massive aircraft order
2011/7/18,Stocks start the week in sell mode
2011/7/14,Stocks drop after Bernanke comments
2011/7/12,Stocks end in the red after Irish debt downgrade
2011/6/22,Stocks end lower on Bernanke bummer
2011/6/21,New rule would speed up union votes
2011/6/20,Paris - Plane spotter's paradise
2011/6/14,Stocks post best gains since April
2011/6/14,Goofy debt ceiling demands
2011/6/10,10 fastest growing states
2011/5/20,A tug-of-war over middle-class jobs
2011/5/19,Stocks: Choppy day as jitters persist
2011/4/28,Stocks hit fresh highs as dollar weakens
2011/4/28,BullHorn: War games
2011/4/27,"Dow, S&P 500 at highest levels since 2008"
2011/4/27,Stocks: All eyes on Bernanke
2011/4/27,We need 21st century air traffic control
2011/4/23,Investors gear up for 'heart of earnings season'
2011/4/19,11 weirdest ways to cash in reward points
2011/4/7,Defense industry braces for shutdown
2011/4/5,6 cities slashing home prices
2011/4/4,Stocks hesitate as investors sit tight
2011/4/4,FAA requiring airlines to inspect Boeing 737s
2011/4/4,Stocks: Basking in jobs afterglow
2011/3/22,Zero G on Ford's factory floor
2011/2/25,Buying Boeing
2011/2/25,Stocks: Worst week since November
2011/2/25,Stocks set for higher open after 3-day rout
2011/2/24,Air Force awards Boeing $35 billion contract
2011/2/24,America's smartest states
2011/2/16,Stocks poised for solid open
2011/2/15,Stocks take worst hit in 2 weeks
2011/2/2,Housing markets: Best recovery bets
2011/1/28,Boeing : We overstretched on 787
2011/1/26,Stocks set to open higher ahead of Fed
2011/1/25,Cashing in on a China bet
2011/1/23,Earnings onslaught coming - but Wall Street may not care
2011/1/20,"Stocks trim losses, close modestly lower"
2011/1/19,China approves $45 billion in U.S. export deals
2011/1/19,Stocks stumble after Goldman Sachs earnings
2011/1/19,Stocks poised for lackluster open
2011/1/19,"Obama, Hu meet American CEOs"
2011/1/18,Stocks gain despite weakness in banking sector
2011/1/17,Airbus beats Boeing in 2010 orders
2011/1/12,Stocks climb to 2-year highs
2011/1/6,Stocks stall ahead of December jobs report
2010/12/20,Stocks end choppy session mixed
2010/12/15,Obama: Get corporate cash 'off the sidelines'
2010/12/15,Obama CEOs: $8.2 million in political muscle
2010/12/15,The 20 CEOs coming to Washington
2010/12/9,Stocks end listless session mixed
2010/12/8,"Banks boost stocks, but gains are modest"
2010/11/24,Stocks end with a bang after jobless claims drop
2010/11/18,Stocks finish higher after GM debut
2010/11/18,Massachusetts gets the new economy best
2010/11/12,Stocks close out worst week in 3 months
2010/11/10,Boeing's Dreamliner snag
2010/11/10,Stocks bounce back
2010/11/10,Boeing cancels Dreamliner test flights
2010/10/27,Stocks falter on questions about Fed stimulus
2010/10/20,Dow holds triple-digit gains
2010/10/20,Stocks set to bounce
2010/10/17,Wall Street gets into the thick of earnings season
2010/10/13,"Stocks rally, but close off session highs"
2010/10/5,"Stocks surge to 5-month highs on Japan, services"
2010/9/16,Stocks stuck in a rut
2010/9/16,Jobless claims down for second week in a row
2010/9/16,Help wanted: Boeing says airlines need 1 million workers
2010/9/16,Stocks poised for weak open
2010/9/9,College grads: Here's what your B.A . is worth
2010/9/8,Big bank bloodbath fears. They're ba-ack!
2010/9/3,Dow back in the black for 2010
2010/9/2,Stocks drift higher ahead of jobs report
2010/9/1,September surprise: Stocks soar
2010/8/26,Stocks slump on slowdown fears
2010/8/4,Can Russia compete in aviation?
2010/7/29,Stocks edge lower
2010/7/28,Stocks fall on economic fears
2010/7/28,Hidden signs of life in the economy
2010/7/28,Stocks set to start lower
2010/7/26,"Stocks rally on housing, FedEx"
2010/7/26,Stocks set for tepid start
2010/7/23,Market will 'drift for the rest of summer'
2010/7/22,Alabama mayor rallies for Airbus
2010/7/19,What makes the Boeing 787 different?
2010/7/19,Wall Street: Bring on the profit reports
2010/7/19,Boeing's Dreamliner arrives in England
2010/7/19,Boeing wins $9.1 billion order from Emirates
2010/7/19,Stocks poised to begin week higher
2010/7/12,Engineering the Boeing 787
2010/7/7,Bank stocks ignite big rally
2010/7/6,Disappearing perk: Employee stock options
2010/6/29,Stocks slammed by global slowdown fears
2010/6/23,Stocks end volatile session mixed
2010/6/22,Stocks slump in volatile trading
2010/6/18,Stocks end higher for second week
2010/6/15,Stocks stage big rally
2010/6/8,Dow in triple-digit comeback
2010/6/8,Airbus gets $11 billion Emirates order
2010/6/4,Dow drops 324 points as euro sinks
2010/5/21,Stocks stage advance
2010/5/19,Continental recalls some furloughed pilots
2010/5/19,Stocks skid on global economic jitters
2010/5/14,Stocks take a hit
2010/5/12,Stocks gain as European fears fade
2010/5/10,Stocks: Best day in 14 months
2010/5/6,Glitches send Dow on wild ride
2010/5/4,Stocks pummeled on debt worries
2010/5/3,Stocks start May strong
2010/4/30,Dow breaks 8-week winning streak
2010/4/27,"Dow plunges 213 points, breaks 11K"
2010/4/21,Stocks seesaw on mixed earnings
2010/4/21,"Dollar gains vs. euro, slips vs. yen"
2010/4/21,Stocks headed for mixed start
2010/4/16,General Electric eyes profit growth for 2010
2010/3/31,Tussle over health care law impact on companies
2010/3/31,Nobody's worried. Time to worry?
2010/3/26,AT&T takes $1 billion health care reform charge
2010/3/23,Bet on the consumer to lead the recovery
2010/3/23,No March Madness for markets
2010/3/22,Dow at 18-month high
2010/3/17,GE: Don't call it a comeback
2010/3/9,Stocks muster gains; Nasdaq at 18-month high
2010/3/9,The Dow's best performer is ...
2010/3/9,Stocks set for opening drop
2010/3/5,Nasdaq at 18-month high
2010/3/3,Stocks give up gains
2010/2/23,"Tacoma, Wash. Tacoma's downtown has gone through a ..."
2010/2/18,Stock rally: Three days and counting
2010/2/16,Dow in triple-digit rally
2010/2/12,America's Cup sponsors abandon ship
2010/2/11,Dow gains 100 points as Greek debt fears ebb
2010/2/4,Dollar gains on global jitters
2010/2/1,Stocks bounce after battering
2010/1/27,Stocks manage gains after Fed
2010/1/20,Stocks get knocked back
2010/1/13,Who would want to be GM's new CEO?
2010/1/8,Stocks stage late advance
2010/1/7,Blue chips gain ahead of jobs report
2010/1/4,Stocks start off 2010 with a rally
2010/1/2,American faces FAA scrutiny after landing problems
2009/12/22,Stocks push higher in light trading
2009/12/22,"Boeing , Airbus sign Asian deals"
2009/12/15,Wall Street breaks win streak
2009/12/15,Stocks on track for lower start
2009/12/11,Dow at new '09 high
2009/12/2,Need jobs now - White House
2009/11/30,Where's my flying car?
2009/11/30,Not ready for takeoff
2009/11/30,"Google, Disney chiefs due at Obama jobs summit"
2009/11/23,Dow spikes to 13-month high
2009/11/11,Inside Donald Trump's private jet
2009/11/10,Donald Trump to personal jet: 'You're fired!'
2009/11/10,Pieces of Madoff
2009/11/5,"Dow reclaims 10,000"
2009/10/29,Dow's best day in 3 months
2009/10/26,Stocks slump as dollar spikes
2009/10/22,Stocks rally on earnings optimism
2009/10/21,Stocks fall from one-year highs
2009/10/21,Weak open seen for stocks
2009/10/21,Housing: Best recovery bets
2009/10/12,"Dow finishes higher - but no 10,000 yet"
2009/10/7,Stocks churn as dollar seesaws
2009/10/6,Stocks jump again
2009/10/6,Boeing's 747-8 costs lead to $1 billion charge
2009/10/5,Stocks recharge the run
2009/10/1,Dow plunges 200 points
2009/9/30,Stocks struggle at quarter end
2009/9/28,Stocks bounce back
2009/9/24,Stocks slide for 2nd straight day
2009/9/17,AMR stock surges on new financing
2009/9/17,GE finally paints it black
2009/9/16,Stocks spike to 1-year highs
2009/9/15,Stocks at new 2009 highs
2009/9/9,Nasdaq and S&P 500 at '09 highs
2009/8/31,Stocks: A down day in a strong month
2009/8/27,Dow makes it 8: Best win streak since April '07
2009/8/27,Wall Street nudging higher
2009/8/25,Stocks touch new '09 highs
2009/8/21,Stocks spike on recovery hopes
2009/8/19,Dollar under pressure
2009/8/17,Stocks tumble on consumer fears
2009/8/14,Stocks end the week with a pullback
2009/8/14,Space elevator chase yields Earthly rewards
2009/8/12,Stocks sustain gains after Fed
2009/8/10,Stocks back away from highs
2009/8/7,Dow and S&P at new '09 highs
2009/7/23,Wall Street rallies to best level of '09
2009/7/23,Stocks poised for modest rally
2009/7/22,Nasdaq posts 11th straight gain
2009/7/21,Dow ends at 6-month high
2009/7/19,Earnings goose a rally - for now
2009/7/15,No end in sight for AIG payback saga
2009/7/13,A big rally for stocks
2009/7/8,Stocks stage late-day turnaround
2009/7/7,Recession fears slam stocks
2009/7/2,Jobs report slams stocks
2009/7/1,"New GM, old faces"
2009/6/30,Goodbye and good riddance' AIG directors!
2009/6/29,Stocks bounce back
2009/6/29,Taxpayers to have say on AIG
2009/6/25,Stocks bounce back
2009/6/24,Stocks trim gains after Fed
2009/6/23,Boeing delays 787 Dreamliner flight again
2009/6/23,Stocks struggle ahead of Fed
2009/6/22,Economic fears slam stocks
2009/6/19,Stocks struggle at end of down week
2009/6/16,Stocks slide for 2nd day
2009/6/15,Recession fears cripple stocks
2009/6/9,"Nasdaq rallies, Dow drifts"
2009/6/9,Big companies make hay off stimulus
2009/6/1,Stocks start June with a bang
2009/5/29,"Sell in June, watch stocks swoon?"
2009/5/22,AIG's Liddy to step down
2009/5/15,Stocks tumble at end of tough week
2009/5/4,Stocks surge on recovery hopes
2009/4/22,Wall Street gives up rally try
2009/4/22,Stocks stage turnaround
2009/4/21,Stocks recharge the advance
2009/4/17,Wall Street: Plan for a storm
2009/4/15,Dow stages late 100-point rally
2009/4/13,Stocks choppy after charge
2009/3/23,Dow jumps almost 500 points
2009/3/6,How to get a green job
2009/3/3,Southwest settles unsafe jet complaints
2009/3/2,"Dollar gains on euro, pound"
2009/2/17,"Mesa, Ariz.: Poster child for foreclosure"
2009/2/6,Job loss: Worst in 34 years
2009/2/2,"Techs rise, blue chips slide"
2009/1/30,6 companies born during downturns
2009/1/30,"Job cuts exceed 100,000 for the week"
2009/1/30,"Worst January ever for Dow, S&P 500"
2009/1/28,Mass layoffs hit seven-year high
2009/1/28,"Employers cut 15,300 more jobs"
2009/1/28,"Boeing posts loss, guides lower"
2009/1/28,Stocks stage rally
2009/1/28,Stocks' big bank boost
2009/1/27,New visions for fixing health care
2009/1/26,The economy's on strike - but for how long?
2009/1/16,Brutal job losses continue in 2009
2009/1/12,Alcoa posts bigger-than-expected loss
2009/1/9,"Boeing cutting 4,500 jobs"
2009/1/9,Stocks knocked by jobs report
2009/1/8,BOE cuts rate to record low
2008/12/22,"Dollar gains against pound, yen"
2008/12/18,"BA , Qantas deal doesn't fly"
2008/12/18,"BA , Qantas merger talks collapse"
2008/12/15,Industrial production resumes decline
2008/12/2,BA in merger talks with Qantas
2008/12/2,Where to hide in the 'bear-cession'
2008/11/26,Biggest durable orders drop in 2 years
2008/11/21,Job cuts cast dark cloud over economy
2008/11/19,Stocks dip in early trade
2008/11/17,Worst...Week...Ever!?
2008/11/17,Factory production rises in October
2008/11/12,Dollar hits 6-year high against pound
2008/11/7,Dollar falls on dour jobs report
2008/11/6,Stocks suffer for 2nd day
2008/11/6,Europe must keep hacking rates
2008/11/5,Dow sheds 486 points
2008/11/5,Dollar mixed as economy weighs on investors
2008/10/30,More pain: Economy shrinks
2008/10/28,"Boeing , union reach tentative deal to end strike"
2008/10/28,Dow's 2nd best day ever
2008/10/23,"Dow gains, Nasdaq wanes"
2008/10/22,Mass layoffs highest since 9/11
2008/10/22,Stocks battered again
2008/10/22,Stocks slump on recession fears
2008/10/20,World markets advance
2008/10/20,Asian markets upbeat
2008/10/16,Factories: Drop worst in 34 years
2008/10/8,World markets return to selloff
2008/9/17,Another thrashing for stocks
2008/9/15,AIG planning big spinoff
2008/9/12,Boeing strike another hit to economy
2008/9/10,Pentagon holds tanker contract until after election
2008/9/10,Stocks manage a modest gain
2008/9/8,"Stocks surge on Fannie, Freddie rescue"
2008/9/6,Union strikes Boeing
2008/9/6,Union set to strike Boeing
2008/9/4,Boeing union threatens strike
2008/9/4,Brutal selloff on Wall Street
2008/8/22,Stocks jump as oil slumps
2008/8/8,Stocks end the week with a bang
2008/7/31,Stocks take a tumble
2008/7/23,McD's hopes to super-size profit
2008/7/21,Dollar slips; investors mull corporate results
2008/7/21,Stocks retreat slightly
2008/7/11,Stocks whipsawed by Fannie and Freddie
2008/7/9,Pentagon will reopen $35B contract
2008/6/25,Stocks trim gains after Fed
2008/6/19,Stocks jump on oil slump
2008/6/19,European markets look ahead
2008/6/19,Stocks set for bumpy open
2008/6/18,Air Force may reopen $35B tanker bid
2008/6/6,Dark day on Wall Street
2008/6/5,"Continental cuts 3,000 jobs, grounds planes"
2008/6/2,Stocks fumble on bank woes
2008/5/21,"Stocks slump on oil surge, day 2"
2008/5/13,Stocks set for positive open
2008/5/9,Why Europe will save us from $5 gas
2008/5/9,Trade gap narrows in March
2008/4/25,Why the worst may be over
2008/4/23,Boeing's bounce
2008/4/23,Wall Street mulls earnings
2008/4/23,An oily mess
2008/4/23,Stocks set to struggle
2008/4/23,Stocks poised for gains
2008/4/22,Customize a Dreamliner
2008/4/22,Stocks slump as oil surges
2008/4/10,Turbulence looms for summer travelers
2008/4/9,Turbulence looms for summer travelers
2008/4/9,Wall Street wary ahead of earnings
2008/4/9,American cancels hundreds of flights
2008/4/3,ATA Airlines files for bankruptcy
2008/3/27,"American, Delta cancel more flights"
2008/3/26,$8.6B Heathrow terminal ready to open
2008/3/26,American cancels hundreds of flights
2008/3/18,America's Money: In their own words
2008/3/15,Stocks tumble on Bear scare
2008/3/14,Stocks tumble on Bear scare
2008/3/12,Experts: Don't fear the weak dollar
2008/3/12,Dow soars 417 on Fed move
2008/3/11,Boeing's day of protest
2008/3/11,Dow's best day in 5-1/2 years
2008/3/11,Stocks set to rally
2008/3/7,Southwest responds to FAA allegations
2008/3/4,Stocks cut losses after choppy session
2008/3/3,Bad news Boeing
2008/3/3,Stocks cut losses after choppy session
2008/3/3,Stocks slightly lower at open
2008/3/3,Stocks off lows despite weak economic report
2008/3/3,Stocks set to open lower
2008/2/22,Stocks slump on recession fears
2008/2/13,Blue chips rally on Buffett
2008/2/12,Blue chips rally on Buffett
2008/2/12,Stock rally accelerates
2008/2/12,Stocks bounce back
2008/2/11,Stocks bounce back up
2008/2/8,Stocks we love
2008/1/30,Stocks volatile after Fed cut
2008/1/30,Stocks pull back at open
2008/1/30,Stocks wait for Big Ben
2008/1/29,"Stocks rally, Day 2"
2008/1/29,Stocks stage late-day run
2008/1/28,What you owe your kids
2008/1/16,Recession fears batter stocks
2008/1/8,Stocks ward off losses
2008/1/7,Stocks ward off losses
2008/1/7,Stock selloff accelerates
2008/1/7,Stocks try to recover
2008/1/7,"Nasdaq slides, Dow drifts"
2008/1/4,Stocks plummet on jobs report
2008/1/4,Stock futures crumble on jobs
2007/12/12,Wall Street to Fed: Not good enough
2007/12/11,Stocks move forward at open
2007/12/11,Here comes the Fed
2007/12/10,Wall Street bets on rate cuts
2007/12/10,Stocks up on rate cut bets
2007/12/10,Stock gains speed up
2007/11/27,Wall Street takes another big hit
2007/11/26,Big selloff on Wall Street
2007/11/26,Stock selloff accelerates
2007/11/26,Stocks turn lower
2007/11/23,Dow cashes in on Black Friday
2007/11/23,Dow ends up over 180
2007/11/23,Stocks snap back after recent rout
2007/11/23,Bargain-hunting on Wall Street
2007/11/15,"After the rally, a retreat"
2007/11/14,U.S. stocks rise at the open
2007/11/11,Gulf airlines sign mass aircraft orders
2007/10/31,Stocks struggle ahead of Fed
2007/10/30,Stocks struggle ahead of Fed
2007/10/30,"Dow dips, Nasdaq rises"
2007/10/30,Stocks turn mixed
2007/10/30,Wall Street braces for the Fed
2007/10/30,Wall Street bets on rate cut
2007/10/25,"Dow reverses course, finishes flat"
2007/10/24,"Dow reverses course, finishes flat"
2007/10/24,Stocks battle back in home stretch
2007/10/24,"Merrill, home sales keep stocks in the red"
2007/10/24,Stock selloff picks up steam
2007/10/24,"Stocks sag on Merrill, home sales"
2007/10/24,Retreat at Wall St. open
2007/10/24,First class gets a 'suite' makeover
2007/10/24,Merrill misery sours stocks' mood
2007/10/24,Bank woes bring out the bears
2007/10/24,Stocks surge on earnings
2007/10/19,"Stocks struggle on earnings, oil"
2007/10/18,"Stocks struggle on earnings, oil"
2007/10/15,Stocks get slammed
2007/10/15,Big selloff on Wall Street
2007/10/12,"Dow hits record, then retreats"
2007/10/12,"Dow hits record, retreats"
2007/10/11,Techs lead Wall Street's downturn
2007/10/11,Banged-up Ford next target for UAW
2007/10/11,Reigniting the rally
2007/10/11,Dow dips after record
2007/10/10,Dow dips after record
2007/10/10,Dow trims losses
2007/10/10,"Dow, S&P 500 fall after records"
2007/10/10,Dow drops nearly 100 points
2007/10/9,Minutes from the Federal Reserve meeting
2007/10/8,UAW starts clock on difficult Chrysler talks
2007/9/28,Ford reportedly eyes more UAW cuts
2007/9/21,"Declining dollar: Who wins, who loses"
2007/9/12,Big rally on Wall Street
2007/9/11,Stocks surge in late trade
2007/9/11,Stock rally speeds up
2007/8/28,Brutal day on Wall Street
2007/8/28,Stock selling picks up steam
2007/8/28,"Stocks slide on Fed, housing woes"
2007/8/28,FAA orders Boeing 737 inspections after fire
2007/8/25,Rally on Wall Street
2007/8/24,Rally on Wall Street
2007/8/24,Stocks struggle on credit woes
2007/8/23,Stocks struggle on credit woes
2007/8/23,Credit woes drag on stocks
2007/8/17,Dow makes stunning comeback
2007/8/16,Dow makes stunning comeback
2007/8/16,Stocks get pummeled again
2007/8/15,Wall St.'s wobbly Wednesday
2007/8/15,Wall Street's terrible Tuesday
2007/8/14,Wall Street's terrible Tuesday
2007/8/14,Wall Street walloped
2007/8/14,Dow tumbles 200 as selloff accelerates
2007/8/14,"Stocks surge, retreat"
2007/8/13,Wall Street fights for gains
2007/8/13,Stocks cling to gains
2007/8/10,Stormy weather on Wall Street
2007/8/10,"Stocks slip, day 2"
2007/8/1,BA slapped with fine
2007/7/26,Wall Street pulls off a winner
2007/7/25,Wall Street pulls off a winner
2007/7/25,Bulls find some momentum
2007/7/25,Wall Street struggles with economic jitters
2007/7/25,Stocks try to shake housing woes
2007/7/25,Stocks try to stay afloat
2007/7/25,Stocks come bouncing back
2007/7/25,Wall Street bounceback
2007/7/25,Wall Street ready to claw back
2007/7/25,Wall Street claws its way back
2007/7/25,Tough day on Wall Street
2007/7/14,Another record setting day on Wall Street
2007/7/10,"Stocks strive for record, come up short"
2007/7/10,Stocks climb as earnings loom
2007/7/9,"Stocks edge up, earnings on tap"
2007/7/9,Stocks on edge as earnings approach
2007/7/9,Stocks battle to stay afloat
2007/7/9,Stocks struggle to gain ground
2007/7/9,Stocks gain at the start
2007/7/9,Shakeup seen at Airbus parent
2007/7/9,Stocks eye earnings boost
2007/7/6,Iced out of a deal with Boeing ?
2007/7/5,Stocks fizzle after the Fourth
2007/7/5,Wall Street trickles back from holiday
2007/6/28,Here comes China 2.0
2007/6/20,Best jobs for the long run
2007/6/19,Wall Street's win streak snapped
2007/6/18,Stocks' 3-session win streak snapped
2007/6/18,Hank Aaron 755 takes flight for Delta
2007/6/18,Stocks in a struggle
2007/6/18,Wall Street: Stuck in neutral
2007/6/18,Stocks struggle for direction
2007/6/18,Stocks retreat into the red
2007/6/18,"New week, new rally"
2007/6/18,Stocks aim to keep rally going
2007/6/14,Bulls fight back
2007/6/13,Stock rally accelerates
2007/6/13,Stocks fight back
2007/6/13,"Bond yields drop, stocks rise"
2007/6/13,Stocks slump as bond yields jump
2007/6/12,Stocks slump as bond yields jump
2007/6/12,"Bond yields soar, stocks slide"
2007/6/12,Stocks try to dig out
2007/6/12,"Stocks down, but stable"
2007/6/12,Stocks rattled by rate woes
2007/6/7,"Stocks slide, day 2"
2007/6/6,"Wall Street walloped, again"
2007/6/6,"Stocks slide, day 2"
2007/6/6,Stocks slump on rate worries
2007/6/6,Rate woes sack stocks
2007/5/31,Record day on Wall Street
2007/5/30,Record day on Wall Street
2007/5/30,Stocks on sunny side of Street
2007/5/30,High expectations on 'the Street'
2007/5/30,Stocks mixed after Fed minutes
2007/5/25,Tough day on Wall Street
2007/5/24,Tough day on Wall Street
2007/5/24,Wall Street washout
2007/5/24,Nasdaq leads selloff
2007/5/10,Bulls flee after weak same-store sales
2007/5/8,"Ford family talks to Wall St. dealmakers, report"
2007/5/1,"A $100,000 lunch, minus the food"
2007/4/30,"A $100,000 lunch, minus the food"
2007/4/26,"Finally, a lucky 13 for Dow"
2007/4/25,"Big day: Dow tops 13,000"
2007/4/25,"Dow soars past 13,000"
2007/4/25,"Dow surges past 13,000"
2007/4/25,"Dow surges past 13,000 for first time"
2007/4/25,"Dow tops 13,000 for first time ever"
2007/4/25,"Bulls off and running, Dow over 13,000"
2007/4/25,Bulls chomping at the bit
